record_id,claim_text,claim_text_normalized,model_text,rating,verdict_text,rating_label,publisher,review_url,review_url_normalized,language,review_date,source_keyword,collected_at,source_tool,raw_source_file,raw_row_index,review_title,review_title_normalized,claim_date,topic
26b6828bb082dbfb,Foto mostra apoiadores em frente à casa de Bolsonaro após decretação de prisão domiciliar,foto mostra apoiadores em frente a casa de bolsonaro apos decretacao de prisao domiciliar,FOTO MOSTRA APOIADORES EM FRENTE A CASA DE BOLSONARO APOS DECRETACAO DE PRISAO DOMICILIAR,FALSO,FALSO,false,Aos Fatos,https://aosfatos.org/noticias/foto-nao-mostra-manifestacao-de-apoiadores-apos-prisao-domiciliar-de-bolsonaro,https://aosfatos.org/noticias/foto-nao-mostra-manifestacao-de-apoiadores-apos-prisao-domiciliar-de-bolsonaro,pt,2025-06-08,bolsonaro,2026-06-03T00:40:15.355960+00:00,factcheckexplorer,query_bolsonaro.csv,138,,,,
32c4ec2c7ea443e9,Reportagem de Cabrini revelou que fraude do INSS financiou campanha de Bolsonaro,reportagem de cabrini revelou que fraude do inss financiou campanha de bolsonaro,REPORTAGEM DE CABRINI REVELOU QUE FRAUDE DO INSS FINANCIOU CAMPANHA DE BOLSONARO,FALSO,FALSO,false,Aos Fatos,https://aosfatos.org/noticias/reportagem-da-record-nao-revelou-que-fraude-do-inss-financiou-campanha-de-bolsonaro,https://aosfatos.org/noticias/reportagem-da-record-nao-revelou-que-fraude-do-inss-financiou-campanha-de-bolsonaro,pt,2025-05-23,campanha | campanha bolsonaro | fraude,2026-06-03T00:40:15.355960+00:00,factcheckexplorer,query_campanha.csv | query_campanha_bolsonaro.csv | query_fraude.csv,14 | 3 | 15,,,,
d7f136cda746952a,Reportagem mostra que fraudes em descontos no INSS começaram em 2005,reportagem mostra que fraudes em descontos no inss comecaram em 2005,REPORTAGEM MOSTRA QUE FRAUDES EM DESCONTOS NO INSS COMECARAM EM 2005,FALSO,FALSO,false,Aos Fatos,https://aosfatos.org/noticias/denuncia-de-fraude-no-inss-em-2005-nao-tem-relacao-com-esquema-atual,https://aosfatos.org/noticias/denuncia-de-fraude-no-inss-em-2005-nao-tem-relacao-com-esquema-atual,pt,2025-05-23,fraude,2026-06-03T00:40:15.355960+00:00,factcheckexplorer,query_fraude.csv,16,,,,
e525372e2c83fb64,Ibrahim Traoré fez discurso ameaçando e criticando Lula,ibrahim traore fez discurso ameacando e criticando lula,IBRAHIM TRAORE FEZ DISCURSO AMEACANDO E CRITICANDO LULA,FALSO,FALSO,false,Aos Fatos,https://aosfatos.org/noticias/video-em-que-presidente-de-burkina-fasso-ameaca-lula-foi-dublado-por-ia,https://aosfatos.org/noticias/video-em-que-presidente-de-burkina-fasso-ameaca-lula-foi-dublado-por-ia,pt,2025-05-21,lula,2026-06-03T00:40:15.355960+00:00,factcheckexplorer,query_lula.csv,208,,,,
586f5fc5b7941859,Reportagem do Jornal Nacional mostra que Bolsonaro é inocente da acusação de golpe de Estado,reportagem do jornal nacional mostra que bolsonaro e inocente da acusacao de golpe de estado,REPORTAGEM DO JORNAL NACIONAL MOSTRA QUE BOLSONARO E INOCENTE DA ACUSACAO DE GOLPE DE ESTADO,FALSO,FALSO,false,Aos Fatos,https://aosfatos.org/noticias/jornal-nacional-nao-veiculou-reportagem-que-afirma-que-bolsonaro-e-inocente,https://aosfatos.org/noticias/jornal-nacional-nao-veiculou-reportagem-que-afirma-que-bolsonaro-e-inocente,pt,2025-05-20,bolsonaro,2026-06-03T00:40:15.355960+00:00,factcheckexplorer,query_bolsonaro.csv,158,,,,
96827432aa5e553e,"Chega, de André Ventura, venceu eleição em Portugal",chega de andre ventura venceu eleicao em portugal,CHEGA DE ANDRE VENTURA VENCEU ELEICAO EM PORTUGAL,FALSO,FALSO,false,Aos Fatos,https://aosfatos.org/noticias/e-falso-que-partido-de-andre-ventura-venceu-eleicoes-em-portugal,https://aosfatos.org/noticias/e-falso-que-partido-de-andre-ventura-venceu-eleicoes-em-portugal,pt,2025-05-19,eleição,2026-06-03T00:40:15.355960+00:00,factcheckexplorer,query_eleicao.csv,39,,,,
2262f1da9aa35bec,Trump chama Lula de ‘desastre total’ em discurso,trump chama lula de desastre total em discurso,TRUMP CHAMA LULA DE DESASTRE TOTAL EM DISCURSO,FALSO,FALSO,false,Aos Fatos,https://aosfatos.org/noticias/video-manipulado-por-ia-faz-crer-que-trump-chamou-lula-de-desastre-total,https://aosfatos.org/noticias/video-manipulado-por-ia-faz-crer-que-trump-chamou-lula-de-desastre-total,pt,2025-05-16,lula,2026-06-03T00:40:15.355960+00:00,factcheckexplorer,query_lula.csv,212,,,,
5f6e51b69575925c,Donald Trump criticou Lula e o chamou de ‘escândalo ambulante’,donald trump criticou lula e o chamou de escandalo ambulante,DONALD TRUMP CRITICOU LULA E O CHAMOU DE ESCANDALO AMBULANTE,FALSO,FALSO,false,Aos Fatos,https://aosfatos.org/noticias/video-em-que-trump-chama-lula-de-escandalo-ambulante-foi-manipulado-por-ia,https://aosfatos.org/noticias/video-em-que-trump-chama-lula-de-escandalo-ambulante-foi-manipulado-por-ia,pt,2025-05-06,lula,2026-06-03T00:40:15.355960+00:00,factcheckexplorer,query_lula.csv,205,,,,
917939d3e8dd10c7,Governo vai subir a idade mínima de aposentadoria para 78 anos,governo vai subir a idade minima de aposentadoria para 78 anos,GOVERNO VAI SUBIR A IDADE MINIMA DE APOSENTADORIA PARA 78 ANOS,FALSO,FALSO,false,Aos Fatos,https://aosfatos.org/noticias/governo-lula-nao-anunciou-que-idade-minima-para-aposentadoria-sera-de-78-anos,https://aosfatos.org/noticias/governo-lula-nao-anunciou-que-idade-minima-para-aposentadoria-sera-de-78-anos,pt,2025-04-25,lula,2026-06-03T00:40:15.355960+00:00,factcheckexplorer,query_lula.csv,222,,,,
1596c879585fc285,Trump criticou intimação enviada por Moraes a Bolsonaro,trump criticou intimacao enviada por moraes a bolsonaro,TRUMP CRITICOU INTIMACAO ENVIADA POR MORAES A BOLSONARO,FALSO,FALSO,false,Aos Fatos,https://aosfatos.org/noticias/trump-nao-criticou-moraes-por-intimar-bolsonaro-na-uti,https://aosfatos.org/noticias/trump-nao-criticou-moraes-por-intimar-bolsonaro-na-uti,pt,2025-04-25,bolsonaro,2026-06-03T00:40:15.355960+00:00,factcheckexplorer,query_bolsonaro.csv,162,,,,
8356f2fca84d315d,Papa Francisco enviou carta para Jair Bolsonaro sobre as eleições de 2026,papa francisco enviou carta para jair bolsonaro sobre as eleicoes de 2026,PAPA FRANCISCO ENVIOU CARTA PARA JAIR BOLSONARO SOBRE AS ELEICOES DE 2026,FALSO,FALSO,false,Aos Fatos,https://aosfatos.org/noticias/e-falso-que-papa-francisco-enviou-recado-a-bolsonaro-antes-de-morrer,https://aosfatos.org/noticias/e-falso-que-papa-francisco-enviou-recado-a-bolsonaro-antes-de-morrer,pt,2025-04-24,eleição,2026-06-03T00:40:15.355960+00:00,factcheckexplorer,query_eleicao.csv,42,,,,
204eb1114d514fe3,Jornal Nacional noticiou que os Estados Unidos ameaçaram romper parcerias com o Brasil caso Jair Bolsonaro seja preso,jornal nacional noticiou que os estados unidos ameacaram romper parcerias com o brasil caso jair bolsonaro seja preso,JORNAL NACIONAL NOTICIOU QUE OS ESTADOS UNIDOS AMEACARAM ROMPER PARCERIAS COM O BRASIL CASO JAIR BOLSONARO SEJA PRESO,FALSO,FALSO,false,Aos Fatos,https://aosfatos.org/noticias/jornal-nacional-nao-noticiou-eua-aplicarao-sancoes-brasil-bolsonaro-preso,https://aosfatos.org/noticias/jornal-nacional-nao-noticiou-eua-aplicarao-sancoes-brasil-bolsonaro-preso,pt,2025-04-17,bolsonaro,2026-06-03T00:40:15.355960+00:00,factcheckexplorer,query_bolsonaro.csv,163,,,,
e3e854203bf3acd9,Mulher progressista se irrita com passageiros que cantavam uma música do Bolsonaro e é retirada a força do avião após agredir aeromoça,mulher progressista se irrita com passageiros que cantavam uma musica do bolsonaro e e retirada a forca do aviao apos agredir aeromoca,MULHER PROGRESSISTA SE IRRITA COM PASSAGEIROS QUE CANTAVAM UMA MUSICA DO BOLSONARO E E RETIRADA A FORCA DO AVIAO APOS AGREDIR AEROMOCA,FALSO,FALSO,false,Aos Fatos,https://aosfatos.org/noticias/tumulto-aviao-sem-relacao-musica-bolsonaro,https://aosfatos.org/noticias/tumulto-aviao-sem-relacao-musica-bolsonaro,pt,2025-04-02,bolsonaro,2026-06-03T00:40:15.355960+00:00,factcheckexplorer,query_bolsonaro.csv,180,,,,
a3469cf7df116816,Advogado do almirante Garnier delatou Jair Bolsonaro e disse que ex-presidente deu “curso prático de golpe”,advogado do almirante garnier delatou jair bolsonaro e disse que ex presidente deu curso pratico de golpe,ADVOGADO DO ALMIRANTE GARNIER DELATOU JAIR BOLSONARO E DISSE QUE EX PRESIDENTE DEU CURSO PRATICO DE GOLPE,FALSO,FALSO,false,Aos Fatos,https://aosfatos.org/noticias/e-falso-advogado-admitiu-bolsonaro-teria-dado-curso-pratico-de-golpe,https://aosfatos.org/noticias/e-falso-advogado-admitiu-bolsonaro-teria-dado-curso-pratico-de-golpe,pt,2025-03-26,bolsonaro,2026-06-03T00:40:15.355960+00:00,factcheckexplorer,query_bolsonaro.csv,167,,,,
84dac3e8d74334c2,"Como é que ele chegou? 29 de julho de 21. (...) E dizendo que eu difundi fake news. Eu difundi o que tinha dentro do inquérito [1.361, de 2018]. Se é fake news, o inquérito é mentiroso.",como e que ele chegou 29 de julho de 21 e dizendo que eu difundi fake news eu difundi o que tinha dentro do inquerito 1 361 de 2018 se e fake news o inquerito e mentiroso,COMO E QUE ELE CHEGOU 29 DE JULHO DE 21 E DIZENDO QUE EU DIFUNDI FAKE NEWS EU DIFUNDI O QUE TINHA DENTRO DO INQUERITO 1 361 DE 2018 SE E FAKE NEWS O INQUERITO E MENTIROSO,FALSO,FALSO,false,Aos Fatos,https://aosfatos.org/noticias/apos-se-tornar-reu-bolsonaro-mente-sobre-8-de-janeiro-e-eleicoes,https://aosfatos.org/noticias/apos-se-tornar-reu-bolsonaro-mente-sobre-8-de-janeiro-e-eleicoes,pt,2025-03-26,bolsonaro,2026-06-03T00:40:15.355960+00:00,factcheckexplorer,query_bolsonaro.csv,176,,,,
14fa24d52261ecc5,[Conclusão do inquérito do PSDB:] as urnas são inauditáveis. Não sou eu que disse isso.,conclusao do inquerito do psdb as urnas sao inauditaveis nao sou eu que disse isso,CONCLUSAO DO INQUERITO DO PSDB AS URNAS SAO INAUDITAVEIS NAO SOU EU QUE DISSE ISSO,FALSO,FALSO,false,Aos Fatos,https://aosfatos.org/noticias/apos-se-tornar-reu-bolsonaro-mente-sobre-8-de-janeiro-e-eleicoes,https://aosfatos.org/noticias/apos-se-tornar-reu-bolsonaro-mente-sobre-8-de-janeiro-e-eleicoes,pt,2025-03-26,bolsonaro | urna,2026-06-03T00:40:15.355960+00:00,factcheckexplorer,query_bolsonaro.csv | query_urna.csv,173 | 9,,,,
a7fc11f0acb5d02b,Eu montei um ministério técnico.,eu montei um ministerio tecnico,EU MONTEI UM MINISTERIO TECNICO,FALSO,FALSO,false,Aos Fatos,https://aosfatos.org/noticias/apos-se-tornar-reu-bolsonaro-mente-sobre-8-de-janeiro-e-eleicoes,https://aosfatos.org/noticias/apos-se-tornar-reu-bolsonaro-mente-sobre-8-de-janeiro-e-eleicoes,pt,2025-03-26,bolsonaro,2026-06-03T00:40:15.355960+00:00,factcheckexplorer,query_bolsonaro.csv,172,,,,
2d8a321e9cc15631,"Eu não interferi no TSE, o outro lado interferiu.",eu nao interferi no tse o outro lado interferiu,EU NAO INTERFERI NO TSE O OUTRO LADO INTERFERIU,FALSO,FALSO,false,Aos Fatos,https://aosfatos.org/noticias/apos-se-tornar-reu-bolsonaro-mente-sobre-8-de-janeiro-e-eleicoes,https://aosfatos.org/noticias/apos-se-tornar-reu-bolsonaro-mente-sobre-8-de-janeiro-e-eleicoes,pt,2025-03-26,bolsonaro,2026-06-03T00:40:15.355960+00:00,factcheckexplorer,query_bolsonaro.csv,174,,,,
a2cf749fd7156aae,Não encontraram nenhuma arma aqui [no 8 de janeiro],nao encontraram nenhuma arma aqui no 8 de janeiro,NAO ENCONTRARAM NENHUMA ARMA AQUI NO 8 DE JANEIRO,FALSO,FALSO,false,Aos Fatos,https://aosfatos.org/noticias/apos-se-tornar-reu-bolsonaro-mente-sobre-8-de-janeiro-e-eleicoes,https://aosfatos.org/noticias/apos-se-tornar-reu-bolsonaro-mente-sobre-8-de-janeiro-e-eleicoes,pt,2025-03-26,bolsonaro,2026-06-03T00:40:15.355960+00:00,factcheckexplorer,query_bolsonaro.csv,171,,,,
50c43d3c568324a7,"O que que o Lula fez no final do ano passado? Teve aqui reunião do G20, [ele] assinou 37 memorandos e acordos com a China. Entre esses acordos, entregou o nosso urânio para a China.",o que que o lula fez no final do ano passado teve aqui reuniao do g20 ele assinou 37 memorandos e acordos com a china entre esses acordos entregou o nosso uranio para a china,O QUE QUE O LULA FEZ NO FINAL DO ANO PASSADO TEVE AQUI REUNIAO DO G20 ELE ASSINOU 37 MEMORANDOS E ACORDOS COM A CHINA ENTRE ESSES ACORDOS ENTREGOU O NOSSO URANIO PARA A CHINA,FALSO,FALSO,false,Aos Fatos,https://aosfatos.org/noticias/apos-se-tornar-reu-bolsonaro-mente-sobre-8-de-janeiro-e-eleicoes,https://aosfatos.org/noticias/apos-se-tornar-reu-bolsonaro-mente-sobre-8-de-janeiro-e-eleicoes,pt,2025-03-26,bolsonaro,2026-06-03T00:40:15.355960+00:00,factcheckexplorer,query_bolsonaro.csv,170,,,,
cace7b9808484a8e,"Quando acabaram as últimas eleições, a última agora, em 2022, o meu partido peticionou no TSE. No dia seguinte, o ministro presidente do TSE, Alexandre de Moraes, não aceitou, mandou arquivar e nos deu uma multa de 22 milhões. Alguém já viu algum advogado ser multado aí, por peticionar o poder judiciário?",quando acabaram as ultimas eleicoes a ultima agora em 2022 o meu partido peticionou no tse no dia seguinte o ministro presidente do tse alexandre de moraes nao aceitou mandou arquivar e nos deu uma multa de 22 milhoes alguem ja viu algum advogado ser multado ai por peticionar o poder judiciario,QUANDO ACABARAM AS ULTIMAS ELEICOES A ULTIMA AGORA EM 2022 O MEU PARTIDO PETICIONOU NO TSE NO DIA SEGUINTE O MINISTRO PRESIDENTE DO TSE ALEXANDRE DE MORAES NAO ACEITOU MANDOU ARQUIVAR E NOS DEU UMA MULTA DE 22 MILHOES ALGUEM JA VIU ALGUM ADVOGADO SER MULTADO AI POR PETICIONAR O PODER JUDICIARIO,FALSO,FALSO,false,Aos Fatos,https://aosfatos.org/noticias/apos-se-tornar-reu-bolsonaro-mente-sobre-8-de-janeiro-e-eleicoes,https://aosfatos.org/noticias/apos-se-tornar-reu-bolsonaro-mente-sobre-8-de-janeiro-e-eleicoes,pt,2025-03-26,bolsonaro,2026-06-03T00:40:15.355960+00:00,factcheckexplorer,query_bolsonaro.csv,175,,,,
593e72389d402a14,"Em discurso no dia 22 de março, Trump diz que reconhece Lula como presidente e que não conhece Bolsonaro",em discurso no dia 22 de marco trump diz que reconhece lula como presidente e que nao conhece bolsonaro,EM DISCURSO NO DIA 22 DE MARCO TRUMP DIZ QUE RECONHECE LULA COMO PRESIDENTE E QUE NAO CONHECE BOLSONARO,FALSO,FALSO,false,Aos Fatos,https://aosfatos.org/noticias/trump-nao-declarou-lula-presidente-e-nao-daria-asilo-bolsonaro,https://aosfatos.org/noticias/trump-nao-declarou-lula-presidente-e-nao-daria-asilo-bolsonaro,pt,2025-03-24,lula,2026-06-03T00:40:15.355960+00:00,factcheckexplorer,query_lula.csv,224,,,,
e558812cf96c2309,Bolsonaro foi inocentado da acusação de tentativa de golpe de Estado,bolsonaro foi inocentado da acusacao de tentativa de golpe de estado,BOLSONARO FOI INOCENTADO DA ACUSACAO DE TENTATIVA DE GOLPE DE ESTADO,FALSO,FALSO,false,Aos Fatos,https://aosfatos.org/noticias/bolsonaro-nao-foi-inocentado-de-acusacao-de-tentativa-de-golpe,https://aosfatos.org/noticias/bolsonaro-nao-foi-inocentado-de-acusacao-de-tentativa-de-golpe,pt,2025-03-21,bolsonaro,2026-06-03T00:40:15.355960+00:00,factcheckexplorer,query_bolsonaro.csv,177,,,,
2ac08224a2a54547,Ministro Alexandre de Moraes libera passaporte de Jair Bolsonaro,ministro alexandre de moraes libera passaporte de jair bolsonaro,MINISTRO ALEXANDRE DE MORAES LIBERA PASSAPORTE DE JAIR BOLSONARO,FALSO,FALSO,false,Aos Fatos,https://aosfatos.org/noticias/alexandre-de-moraes-nao-liberou-passaporte-de-jair-bolsonaro,https://aosfatos.org/noticias/alexandre-de-moraes-nao-liberou-passaporte-de-jair-bolsonaro,pt,2025-03-20,bolsonaro,2026-06-03T00:40:15.355960+00:00,factcheckexplorer,query_bolsonaro.csv,178,,,,
a3c79faef4a73dba,Lula prometeu acabar com o Facebook,lula prometeu acabar com o facebook,LULA PROMETEU ACABAR COM O FACEBOOK,FALSO,FALSO,false,Aos Fatos,https://aosfatos.org/noticias/e-falso-que-lula-prometeu-acabar-com-o-facebook,https://aosfatos.org/noticias/e-falso-que-lula-prometeu-acabar-com-o-facebook,pt,2025-03-13,lula,2026-06-03T00:40:15.355960+00:00,factcheckexplorer,query_lula.csv,225,,,,
deaeb1bcdee30f73,Lula chama Cláudio Castro de ‘picareta’ após operação no Rio,lula chama claudio castro de picareta apos operacao no rio,LULA CHAMA CLAUDIO CASTRO DE PICARETA APOS OPERACAO NO RIO,FALSO,FALSO,false,Aos Fatos,https://aosfatos.org/noticias/lula-chamou-witzel-e-nao-claudio-castro-de-picareta,https://aosfatos.org/noticias/lula-chamou-witzel-e-nao-claudio-castro-de-picareta,pt,2025-03-11,lula,2026-06-03T00:40:15.355960+00:00,factcheckexplorer,query_lula.csv,173,,,,
b1451dc10286eb54,Pesquisa revela que 82% dos brasileiros deportados dos Estados Unidos votaram em Lula (PT) na última eleição,pesquisa revela que 82 dos brasileiros deportados dos estados unidos votaram em lula pt na ultima eleicao,PESQUISA REVELA QUE 82 DOS BRASILEIROS DEPORTADOS DOS ESTADOS UNIDOS VOTARAM EM LULA PT NA ULTIMA ELEICAO,FALSO,FALSO,false,Aos Fatos,https://aosfatos.org/noticias/percentual-falso-deportados-votaram-em-lula,https://aosfatos.org/noticias/percentual-falso-deportados-votaram-em-lula,pt,2025-03-02,eleição | pt,2026-06-03T00:40:15.355960+00:00,factcheckexplorer,query_eleicao.csv | query_pt.csv,48 | 22,,,,
3571c55323a4e6b9,Financial Times disse que Joe Biden fraudou eleições brasileiras de 2022,financial times disse que joe biden fraudou eleicoes brasileiras de 2022,FINANCIAL TIMES DISSE QUE JOE BIDEN FRAUDOU ELEICOES BRASILEIRAS DE 2022,FALSO,FALSO,false,Aos Fatos,https://aosfatos.org/noticias/financial-times-biden-eleicoes-brasileiras,https://aosfatos.org/noticias/financial-times-biden-eleicoes-brasileiras,pt,2025-02-28,eleição,2026-06-03T00:40:15.355960+00:00,factcheckexplorer,query_eleicao.csv,44,,,,
9f877b1fdbe63106,TSE vai destruir 195 mil urnas para esconder provas de fraude,tse vai destruir 195 mil urnas para esconder provas de fraude,TSE VAI DESTRUIR 195 MIL URNAS PARA ESCONDER PROVAS DE FRAUDE,FALSO,FALSO,false,Aos Fatos,https://aosfatos.org/noticias/tse-destruir-urnas-provas-fraude,https://aosfatos.org/noticias/tse-destruir-urnas-provas-fraude,pt,2025-02-27,urna,2026-06-03T00:40:15.355960+00:00,factcheckexplorer,query_urna.csv,16,,,,
420566ffd539b6e5,Elon Musk postou no X provas de que eleições brasileiras foram fraudadas e que Jair Bolsonaro (PL) venceu as eleições de 2022,elon musk postou no x provas de que eleicoes brasileiras foram fraudadas e que jair bolsonaro pl venceu as eleicoes de 2022,ELON MUSK POSTOU NO X PROVAS DE QUE ELEICOES BRASILEIRAS FORAM FRAUDADAS E QUE JAIR BOLSONARO PL VENCEU AS ELEICOES DE 2022,FALSO,FALSO,false,Aos Fatos,https://aosfatos.org/noticias/falso-elon-musk-publicou-prova-vitoria-bolsonaro-2022,https://aosfatos.org/noticias/falso-elon-musk-publicou-prova-vitoria-bolsonaro-2022,pt,2025-02-19,eleição,2026-06-03T00:40:15.355960+00:00,factcheckexplorer,query_eleicao.csv,46,,,,
3d2f7d0e0e0d2350,Irmãos de Lula e Flávio Dino estão envolvidos no esquema do INSS,irmaos de lula e flavio dino estao envolvidos no esquema do inss,IRMAOS DE LULA E FLAVIO DINO ESTAO ENVOLVIDOS NO ESQUEMA DO INSS,FALSO,FALSO,false,Aos Fatos,https://aosfatos.org/noticias/irmaos-de-lula-e-de-flavio-dino-nao-sao-investigados-por-fraude-no-inss,https://aosfatos.org/noticias/irmaos-de-lula-e-de-flavio-dino-nao-sao-investigados-por-fraude-no-inss,pt,2025-02-10,fraude,2026-06-03T00:40:15.355960+00:00,factcheckexplorer,query_fraude.csv,9,,,,
51ec16b046adf396,Trump virá ao Brasil acompanhar julgamento de Bolsonaro,trump vira ao brasil acompanhar julgamento de bolsonaro,TRUMP VIRA AO BRASIL ACOMPANHAR JULGAMENTO DE BOLSONARO,FALSO,FALSO,false,Aos Fatos,https://aosfatos.org/noticias/trump-nao-vira-ao-brasil-acompanhar-julgamento-de-bolsonaro,https://aosfatos.org/noticias/trump-nao-vira-ao-brasil-acompanhar-julgamento-de-bolsonaro,pt,2025-02-09,bolsonaro,2026-06-03T00:40:15.355960+00:00,factcheckexplorer,query_bolsonaro.csv,134,,,,
8465bb7360150bce,Presidente Lula manda resposta afiada às declarações do presidente americano Donald Trump sobre os Estados Unidos não precisarem do Brasil.,presidente lula manda resposta afiada as declaracoes do presidente americano donald trump sobre os estados unidos nao precisarem do brasil,PRESIDENTE LULA MANDA RESPOSTA AFIADA AS DECLARACOES DO PRESIDENTE AMERICANO DONALD TRUMP SOBRE OS ESTADOS UNIDOS NAO PRECISAREM DO BRASIL,FALSO,FALSO,false,Aos Fatos,https://aosfatos.org/noticias/video-antigo-lula-nao-resposta-trump,https://aosfatos.org/noticias/video-antigo-lula-nao-resposta-trump,pt,2025-01-24,lula,2026-06-03T00:40:15.355960+00:00,factcheckexplorer,query_lula.csv,237,,,,
265c9cc7fcd109ec,Trump convidou Lula para sua posse,trump convidou lula para sua posse,TRUMP CONVIDOU LULA PARA SUA POSSE,FALSO,FALSO,false,Aos Fatos,https://aosfatos.org/noticias/trump-nao-convidou-lula-para-posse,https://aosfatos.org/noticias/trump-nao-convidou-lula-para-posse,pt,2025-01-17,lula,2026-06-03T00:40:15.355960+00:00,factcheckexplorer,query_lula.csv,239,,,,
ccd9f6b431891764,Veto de Lula suspendeu pensão concedida a crianças vítimas da Zika,veto de lula suspendeu pensao concedida a criancas vitimas da zika,VETO DE LULA SUSPENDEU PENSAO CONCEDIDA A CRIANCAS VITIMAS DA ZIKA,FALSO,FALSO,false,Aos Fatos,https://aosfatos.org/noticias/falso-lula-suspendeu-pensao-criancas-zika,https://aosfatos.org/noticias/falso-lula-suspendeu-pensao-criancas-zika,pt,2025-01-15,lula,2026-06-03T00:40:15.355960+00:00,factcheckexplorer,query_lula.csv,240,,,,
fd8ab87286ca1cb0,Vídeo mostra Bolsonaro recebendo atendimento médico na sede da PF após prisão,video mostra bolsonaro recebendo atendimento medico na sede da pf apos prisao,VIDEO MOSTRA BOLSONARO RECEBENDO ATENDIMENTO MEDICO NA SEDE DA PF APOS PRISAO,FALSO,FALSO,false,Aos Fatos,https://aosfatos.org/noticias/video-mostra-atendimento-medico-a-bolsonaro-em-abril-nao-apos-prisao,https://aosfatos.org/noticias/video-mostra-atendimento-medico-a-bolsonaro-em-abril-nao-apos-prisao,pt,2025-01-12,bolsonaro,2026-06-03T00:40:15.355960+00:00,factcheckexplorer,query_bolsonaro.csv,114,,,,
dfbbee297e1fa952,Alexandre de Moraes retirou toda a segurança pessoal de Bolsonaro,alexandre de moraes retirou toda a seguranca pessoal de bolsonaro,ALEXANDRE DE MORAES RETIROU TODA A SEGURANCA PESSOAL DE BOLSONARO,FALSO,FALSO,false,Aos Fatos,https://aosfatos.org/noticias/moraes-nao-retirou-seguranca-pessoal-bolsonaro,https://aosfatos.org/noticias/moraes-nao-retirou-seguranca-pessoal-bolsonaro,pt,2025-01-10,bolsonaro,2026-06-03T00:40:15.355960+00:00,factcheckexplorer,query_bolsonaro.csv,126,,,,
1e85ad8a45d86d86,"E hoje tenho orgulho de ser o presidente da República, único no país, que não tem diploma universitário",e hoje tenho orgulho de ser o presidente da republica unico no pais que nao tem diploma universitario,E HOJE TENHO ORGULHO DE SER O PRESIDENTE DA REPUBLICA UNICO NO PAIS QUE NAO TEM DIPLOMA UNIVERSITARIO,FALSO,FALSO,false,Aos Fatos,https://aosfatos.org/noticias/lula-2024-desinformou-fome-educacao,https://aosfatos.org/noticias/lula-2024-desinformou-fome-educacao,pt,2024-12-23,lula,2026-06-03T00:40:15.355960+00:00,factcheckexplorer,query_lula.csv,242,,,,
ce7bec3ee1801d96,"Nós acabamos com a fome em 2014. Quando eu voltei [à Presidência], tinha 33 milhões de pessoas passando fome.",nos acabamos com a fome em 2014 quando eu voltei a presidencia tinha 33 milhoes de pessoas passando fome,NOS ACABAMOS COM A FOME EM 2014 QUANDO EU VOLTEI A PRESIDENCIA TINHA 33 MILHOES DE PESSOAS PASSANDO FOME,FALSO,FALSO,false,Aos Fatos,https://aosfatos.org/noticias/lula-2024-desinformou-fome-educacao,https://aosfatos.org/noticias/lula-2024-desinformou-fome-educacao,pt,2024-12-23,lula,2026-06-03T00:40:15.355960+00:00,factcheckexplorer,query_lula.csv,243,,,,
c1d8d6e58fccbc6e,Porque nós encontramos esse país com 6.000 creches paralisadas.,porque nos encontramos esse pais com 6 000 creches paralisadas,PORQUE NOS ENCONTRAMOS ESSE PAIS COM 6 000 CRECHES PARALISADAS,FALSO,FALSO,false,Aos Fatos,https://aosfatos.org/noticias/lula-2024-desinformou-fome-educacao,https://aosfatos.org/noticias/lula-2024-desinformou-fome-educacao,pt,2024-12-23,lula,2026-06-03T00:40:15.355960+00:00,factcheckexplorer,query_lula.csv,246,,,,
18643350572ee624,Desembargador defendeu bolsonarista que matou tesoureiro do PT durante festa de aniversário,desembargador defendeu bolsonarista que matou tesoureiro do pt durante festa de aniversario,DESEMBARGADOR DEFENDEU BOLSONARISTA QUE MATOU TESOUREIRO DO PT DURANTE FESTA DE ANIVERSARIO,FALSO,FALSO,false,Aos Fatos,https://aosfatos.org/noticias/falso-desembargador-petista-assassinado-pessoa-de-ma-qualidade,https://aosfatos.org/noticias/falso-desembargador-petista-assassinado-pessoa-de-ma-qualidade,pt,2024-12-18,pt,2026-06-03T00:40:15.355960+00:00,factcheckexplorer,query_pt.csv,23,,,,
77d79ed12225e9a0,Maduro pede socorro ao Papa após Trump vencer as eleições de 2024,maduro pede socorro ao papa apos trump vencer as eleicoes de 2024,MADURO PEDE SOCORRO AO PAPA APOS TRUMP VENCER AS ELEICOES DE 2024,FALSO,FALSO,false,Aos Fatos,https://aosfatos.org/noticias/antigo-video-maduro-papa-invasao-venezuela-trump,https://aosfatos.org/noticias/antigo-video-maduro-papa-invasao-venezuela-trump,pt,2024-12-11,eleição,2026-06-03T00:40:15.355960+00:00,factcheckexplorer,query_eleicao.csv,53,,,,
99c3c55d9dfca78a,Lula (PT) vendeu a maior reserva de urânio da Amazônia para a China,lula pt vendeu a maior reserva de uranio da amazonia para a china,LULA PT VENDEU A MAIOR RESERVA DE URANIO DA AMAZONIA PARA A CHINA,FALSO,FALSO,false,Aos Fatos,https://aosfatos.org/noticias/lula-nao-vendeu-reserva-de-uranio-para-a-china,https://aosfatos.org/noticias/lula-nao-vendeu-reserva-de-uranio-para-a-china,pt,2024-11-29,pt,2026-06-03T00:40:15.355960+00:00,factcheckexplorer,query_pt.csv,24,,,,
