record_id,claim_text,claim_text_normalized,model_text,rating,verdict_text,rating_label,publisher,review_url,review_url_normalized,language,review_date,source_keyword,collected_at,source_tool,raw_source_file,raw_row_index,review_title,review_title_normalized,claim_date,topic
901ca75a78a2695a,Fraude comprovada nas urnas em 2022,fraude comprovada nas urnas em 2022,FRAUDE COMPROVADA NAS URNAS EM 2022,FALSO,FALSO,false,UOL Notícias,https://noticias.uol.com.br/confere/ultimas-noticias/2025/06/12/documentos-de-agencia-dos-eua-nao-provam-fraude-nas-urnas-no-brasil.htm,https://noticias.uol.com.br/confere/ultimas-noticias/2025/06/12/documentos-de-agencia-dos-eua-nao-provam-fraude-nas-urnas-no-brasil.htm,pt,2025-12-06,urna,2026-06-03T00:40:15.355960+00:00,factcheckexplorer,query_urna.csv,8,,,,
4ea5226fcc88d1a1,Jornada da Maitê,jornada da maite,JORNADA DA MAITE,FALSO,FALSO,false,UOL Notícias,https://noticias.uol.com.br/confere/ultimas-noticias/2025/11/28/falsa-campanha-ajuda-maite-golpe.htm,https://noticias.uol.com.br/confere/ultimas-noticias/2025/11/28/falsa-campanha-ajuda-maite-golpe.htm,pt,2025-11-28,campanha,2026-06-03T00:40:15.355960+00:00,factcheckexplorer,query_campanha.csv,2,,,,
d30af3e9bdb76b38,"Michelle Bolsonaro segura cartaz com a frase: ""Libertem o noso presidente Bolsonaro. Anistia já""",michelle bolsonaro segura cartaz com a frase libertem o noso presidente bolsonaro anistia ja,MICHELLE BOLSONARO SEGURA CARTAZ COM A FRASE LIBERTEM O NOSO PRESIDENTE BOLSONARO ANISTIA JA,FALSO,FALSO,false,UOL Notícias,https://noticias.uol.com.br/confere/ultimas-noticias/2025/11/20/falso-imagem-michelle-cartaz-libertacao-bolsonaro.htm,https://noticias.uol.com.br/confere/ultimas-noticias/2025/11/20/falso-imagem-michelle-cartaz-libertacao-bolsonaro.htm,pt,2025-11-20,bolsonaro,2026-06-03T00:40:15.355960+00:00,factcheckexplorer,query_bolsonaro.csv,121,,,,
7ee6a91f0ba7775d,"Ajude o Isaac. Ele perdeu o pai, e agora descobriu um câncer. Agora, ele precisa realizar a cirurgia de remoção do câncer urgente, antes da metástase.",ajude o isaac ele perdeu o pai e agora descobriu um cancer agora ele precisa realizar a cirurgia de remocao do cancer urgente antes da metastase,AJUDE O ISAAC ELE PERDEU O PAI E AGORA DESCOBRIU UM CANCER AGORA ELE PRECISA REALIZAR A CIRURGIA DE REMOCAO DO CANCER URGENTE ANTES DA METASTASE,FALSO,FALSO,false,UOL Notícias,https://noticias.uol.com.br/confere/ultimas-noticias/2025/03/11/e-falsa-campanha-de-arrecadacao-para-cirurgia-de-menino-isaac-e-golpe.htm,https://noticias.uol.com.br/confere/ultimas-noticias/2025/03/11/e-falsa-campanha-de-arrecadacao-para-cirurgia-de-menino-isaac-e-golpe.htm,pt,2025-11-03,campanha,2026-06-03T00:40:15.355960+00:00,factcheckexplorer,query_campanha.csv,16,,,,
2742b96149dd4342,BOLSONARO GANHA IMUNIDADE DIPLOMÁTICA E JÁ MONTA EQUIPE INTERNACIONAL,bolsonaro ganha imunidade diplomatica e ja monta equipe internacional,BOLSONARO GANHA IMUNIDADE DIPLOMATICA E JA MONTA EQUIPE INTERNACIONAL,FALSO,FALSO,false,UOL Notícias,https://noticias.uol.com.br/confere/ultimas-noticias/2025/10/27/falso-trump-imunidade-bolsonaro-cargo-internacional.htm,https://noticias.uol.com.br/confere/ultimas-noticias/2025/10/27/falso-trump-imunidade-bolsonaro-cargo-internacional.htm,pt,2025-10-27,bolsonaro,2026-06-03T00:40:15.355960+00:00,factcheckexplorer,query_bolsonaro.csv,123,,,,
8fd0fc729dc87b41,A intervenção da CIA e Biden nas eleições brasileiras 2022 Governo americano acusa Mourão de traição!,a intervencao da cia e biden nas eleicoes brasileiras 2022 governo americano acusa mourao de traicao,A INTERVENCAO DA CIA E BIDEN NAS ELEICOES BRASILEIRAS 2022 GOVERNO AMERICANO ACUSA MOURAO DE TRAICAO,FALSO,FALSO,false,UOL Notícias,https://noticias.uol.com.br/confere/ultimas-noticias/2025/10/16/falso-ana-priscila-azevedo-nao-condenada-mourao-informante-cia.htm,https://noticias.uol.com.br/confere/ultimas-noticias/2025/10/16/falso-ana-priscila-azevedo-nao-condenada-mourao-informante-cia.htm,pt,2025-10-16,eleição,2026-06-03T00:40:15.355960+00:00,factcheckexplorer,query_eleicao.csv,27,,,,
9ea5cc220e8d5f61,No congresso americano todas as urnas foram hackeadas em menos de duas horas,no congresso americano todas as urnas foram hackeadas em menos de duas horas,NO CONGRESSO AMERICANO TODAS AS URNAS FORAM HACKEADAS EM MENOS DE DUAS HORAS,FALSO,FALSO,false,UOL Notícias,https://noticias.uol.com.br/comprova/ultimas-noticias/2025/11/10/urnas-eletronicas-brasileiras-nao-foram-fraudadas-em-evento-em-las-vegas.htm,https://noticias.uol.com.br/comprova/ultimas-noticias/2025/11/10/urnas-eletronicas-brasileiras-nao-foram-fraudadas-em-evento-em-las-vegas.htm,pt,2025-10-11,urna,2026-06-03T00:40:15.355960+00:00,factcheckexplorer,query_urna.csv,4,,,,
c547e15df0c30bfd,Torcida do Flamengo quer Bolsonaro na prisão,torcida do flamengo quer bolsonaro na prisao,TORCIDA DO FLAMENGO QUER BOLSONARO NA PRISAO,FALSO,FALSO,false,UOL Notícias,https://noticias.uol.com.br/confere/ultimas-noticias/2025/09/29/falso-torcida-flamengo-protesto-bolsonaro.htm,https://noticias.uol.com.br/confere/ultimas-noticias/2025/09/29/falso-torcida-flamengo-protesto-bolsonaro.htm,pt,2025-09-29,bolsonaro,2026-06-03T00:40:15.355960+00:00,factcheckexplorer,query_bolsonaro.csv,128,,,,
ffa16de59a9acaae,Polícia Federal fez dossiê contra Nikolas Ferreira e irmão de Bolsonaro,policia federal fez dossie contra nikolas ferreira e irmao de bolsonaro,POLICIA FEDERAL FEZ DOSSIE CONTRA NIKOLAS FERREIRA E IRMAO DE BOLSONARO,FALSO,FALSO,false,UOL Notícias,https://noticias.uol.com.br/confere/ultimas-noticias/2025/12/09/falso-video-dossie-pf-nikolas-ferreira-irmao-bolsonaro.htm,https://noticias.uol.com.br/confere/ultimas-noticias/2025/12/09/falso-video-dossie-pf-nikolas-ferreira-irmao-bolsonaro.htm,pt,2025-09-12,bolsonaro,2026-06-03T00:40:15.355960+00:00,factcheckexplorer,query_bolsonaro.csv,112,,,,
7a2dcc22b5b359eb,Vazou áudio William Bonner Globo lucra bilhões com o PT no governo,vazou audio william bonner globo lucra bilhoes com o pt no governo,VAZOU AUDIO WILLIAM BONNER GLOBO LUCRA BILHOES COM O PT NO GOVERNO,FALSO,FALSO,false,UOL Notícias,https://noticias.uol.com.br/confere/ultimas-noticias/2025/09/09/e-falso-audio-de-bonner-falando-que-ajudou-a-eleger-lula.htm,https://noticias.uol.com.br/confere/ultimas-noticias/2025/09/09/e-falso-audio-de-bonner-falando-que-ajudou-a-eleger-lula.htm,pt,2025-09-09,pt,2026-06-03T00:40:15.355960+00:00,factcheckexplorer,query_pt.csv,9,,,,
8aee75e08a1747fc,Barroso pagou 9 milhões para cada líder e vice-líder partidário para que trocassem os deputados que votariam a favor do voto impresso por políticos que eram contrários.,barroso pagou 9 milhoes para cada lider e vice lider partidario para que trocassem os deputados que votariam a favor do voto impresso por politicos que eram contrarios,BARROSO PAGOU 9 MILHOES PARA CADA LIDER E VICE LIDER PARTIDARIO PARA QUE TROCASSEM OS DEPUTADOS QUE VOTARIAM A FAVOR DO VOTO IMPRESSO POR POLITICOS QUE ERAM CONTRARIOS,FALSO,FALSO,false,UOL Notícias,https://noticias.uol.com.br/confere/ultimas-noticias/2025/08/13/e-falso-que-barroso-pagou-para-deputados-votarem-contra-voto-impresso.htm,https://noticias.uol.com.br/confere/ultimas-noticias/2025/08/13/e-falso-que-barroso-pagou-para-deputados-votarem-contra-voto-impresso.htm,pt,2025-08-13,e verdade voto impresso | pec voto impresso | voto | voto impresso,2026-06-03T00:40:15.355960+00:00,factcheckexplorer,query_e_verdade_voto_impresso.csv | query_pec_voto_impresso.csv | query_voto.csv | query_voto_impresso.csv,7 | 2 | 15,,,,
13c99d78a819ff4b,Luciano Hang declarou voto em Lula (PT) para 2026,luciano hang declarou voto em lula pt para 2026,LUCIANO HANG DECLAROU VOTO EM LULA PT PARA 2026,FALSO,FALSO,false,UOL Notícias,https://noticias.uol.com.br/comprova/ultimas-noticias/2025/08/08/video-tem-audio-manipulado-para-inventar-apoio-de-hang-a-lula-em-2026.htm,https://noticias.uol.com.br/comprova/ultimas-noticias/2025/08/08/video-tem-audio-manipulado-para-inventar-apoio-de-hang-a-lula-em-2026.htm,pt,2025-08-08,pt,2026-06-03T00:40:15.355960+00:00,factcheckexplorer,query_pt.csv,11,,,,
ca558c59e61d3443,"""Você comeu hoje. O Lucas não pode. E não é porque ele não quer? é porque dói. Fica até o fim. A história dele precisa ser ouvida""",voce comeu hoje o lucas nao pode e nao e porque ele nao quer e porque doi fica ate o fim a historia dele precisa ser ouvida,VOCE COMEU HOJE O LUCAS NAO PODE E NAO E PORQUE ELE NAO QUER E PORQUE DOI FICA ATE O FIM A HISTORIA DELE PRECISA SER OUVIDA,FALSO,FALSO,false,UOL Notícias,https://noticias.uol.com.br/confere/ultimas-noticias/2025/07/08/nikolas-ferreira-doacao-menino-lucas-falso-golpe.htm,https://noticias.uol.com.br/confere/ultimas-noticias/2025/07/08/nikolas-ferreira-doacao-menino-lucas-falso-golpe.htm,pt,2025-08-07,campanha,2026-06-03T00:40:15.355960+00:00,factcheckexplorer,query_campanha.csv,52,,,,
9bc896c54e70ca66,"A pequena Maria sofre todos os dias com dores intensas causadas por uma doença rara na pele chamada Epidermólise Bolhosa, que forma bolhas e provoca a perda de até 80% da pele. Ela precisa de remédios para dor diariamente ? sem eles, não consegue suportar o sofrimento. Sua doação vai ajudar a garantir que Maria nunca fique sem os remédios que aliviam suas dores.",a pequena maria sofre todos os dias com dores intensas causadas por uma doenca rara na pele chamada epidermolise bolhosa que forma bolhas e provoca a perda de ate 80 da pele ela precisa de remedios para dor diariamente sem eles nao consegue suportar o sofrimento sua doacao vai ajudar a garantir que maria nunca fique sem os remedios que aliviam suas dores,A PEQUENA MARIA SOFRE TODOS OS DIAS COM DORES INTENSAS CAUSADAS POR UMA DOENCA RARA NA PELE CHAMADA EPIDERMOLISE BOLHOSA QUE FORMA BOLHAS E PROVOCA A PERDA DE ATE 80 DA PELE ELA PRECISA DE REMEDIOS PARA DOR DIARIAMENTE SEM ELES NAO CONSEGUE SUPORTAR O SOFRIMENTO SUA DOACAO VAI AJUDAR A GARANTIR QUE MARIA NUNCA FIQUE SEM OS REMEDIOS QUE ALIVIAM SUAS DORES,FALSO,FALSO,false,UOL Notícias,https://noticias.uol.com.br/confere/ultimas-noticias/2025/05/08/bispo-campanha-doacao-maria-eduarda-falso.htm,https://noticias.uol.com.br/confere/ultimas-noticias/2025/05/08/bispo-campanha-doacao-maria-eduarda-falso.htm,pt,2025-08-05,campanha,2026-06-03T00:40:15.355960+00:00,factcheckexplorer,query_campanha.csv,35,,,,
98e42215783c6716,Vídeo que o PT nega existir. Nine interagindo com o Marcola,video que o pt nega existir nine interagindo com o marcola,VIDEO QUE O PT NEGA EXISTIR NINE INTERAGINDO COM O MARCOLA,FALSO,FALSO,false,UOL Notícias,https://noticias.uol.com.br/confere/ultimas-noticias/2025/05/08/lula-nao-estava-com-o-marcola-criminoso-do-pcc.htm,https://noticias.uol.com.br/confere/ultimas-noticias/2025/05/08/lula-nao-estava-com-o-marcola-criminoso-do-pcc.htm,pt,2025-08-05,pt,2026-06-03T00:40:15.355960+00:00,factcheckexplorer,query_pt.csv,19,,,,
05ced11cce776da6,Trump liga para Bolsonaro durante manifestação e faz ele chorar ao vivo,trump liga para bolsonaro durante manifestacao e faz ele chorar ao vivo,TRUMP LIGA PARA BOLSONARO DURANTE MANIFESTACAO E FAZ ELE CHORAR AO VIVO,FALSO,FALSO,false,UOL Notícias,https://noticias.uol.com.br/confere/ultimas-noticias/2025/04/08/trump-ligacao-bolsonaro-ato-paulista-anistia-falso.htm,https://noticias.uol.com.br/confere/ultimas-noticias/2025/04/08/trump-ligacao-bolsonaro-ato-paulista-anistia-falso.htm,pt,2025-08-04,bolsonaro,2026-06-03T00:40:15.355960+00:00,factcheckexplorer,query_bolsonaro.csv,165,,,,
da36ae3bf2d849d7,"""Henrique precisa de tratamento para não perder os movimentos. Imagine ver seu filho deixar de andar aos poucos. Esse é o dia a dia do Henrique, de 6 anos, diagnosticado com uma doença degenerativa chamada Distrofia de Duchenne. Ele precisa de tratamento urgente para preservar sua força e garantir qualidade de vida""",henrique precisa de tratamento para nao perder os movimentos imagine ver seu filho deixar de andar aos poucos esse e o dia a dia do henrique de 6 anos diagnosticado com uma doenca degenerativa chamada distrofia de duchenne ele precisa de tratamento urgente para preservar sua forca e garantir qualidade de vida,HENRIQUE PRECISA DE TRATAMENTO PARA NAO PERDER OS MOVIMENTOS IMAGINE VER SEU FILHO DEIXAR DE ANDAR AOS POUCOS ESSE E O DIA A DIA DO HENRIQUE DE 6 ANOS DIAGNOSTICADO COM UMA DOENCA DEGENERATIVA CHAMADA DISTROFIA DE DUCHENNE ELE PRECISA DE TRATAMENTO URGENTE PARA PRESERVAR SUA FORCA E GARANTIR QUALIDADE DE VIDA,FALSO,FALSO,false,UOL Notícias,https://noticias.uol.com.br/confere/ultimas-noticias/2025/07/18/campanha-falsa-menino-henrique-golpe.htm,https://noticias.uol.com.br/confere/ultimas-noticias/2025/07/18/campanha-falsa-menino-henrique-golpe.htm,pt,2025-07-18,campanha,2026-06-03T00:40:15.355960+00:00,factcheckexplorer,query_campanha.csv,51,,,,
735e76b44e74106b,Lula fala de mandar Brasileiros para o Irã? Lula fala sobre guerra de Israel e Irã,lula fala de mandar brasileiros para o ira lula fala sobre guerra de israel e ira,LULA FALA DE MANDAR BRASILEIROS PARA O IRA LULA FALA SOBRE GUERRA DE ISRAEL E IRA,FALSO,FALSO,false,UOL Notícias,https://noticias.uol.com.br/comprova/ultimas-noticias/2025/06/26/lula-nao-declarou-apoio-ao-ira-na-guerra-video-foi-gerado-por-ia.htm,https://noticias.uol.com.br/comprova/ultimas-noticias/2025/06/26/lula-nao-declarou-apoio-ao-ira-na-guerra-video-foi-gerado-por-ia.htm,pt,2025-06-26,lula,2026-06-03T00:40:15.355960+00:00,factcheckexplorer,query_lula.csv,196,,,,
89c28fa7184f1f57,"""SALVE O DUDU. COMPRE A RIFA AGORA CLICANDO NO LINK ABAIXO. TEMOS MENOS DE 1 MÊS PARA SALVAR A VIDA DELE""",salve o dudu compre a rifa agora clicando no link abaixo temos menos de 1 mes para salvar a vida dele,SALVE O DUDU COMPRE A RIFA AGORA CLICANDO NO LINK ABAIXO TEMOS MENOS DE 1 MES PARA SALVAR A VIDA DELE,FALSO,FALSO,false,UOL Notícias,https://noticias.uol.com.br/confere/ultimas-noticias/2025/05/27/post-falso-simula-campanha-ajuda-dudu-golpe.htm,https://noticias.uol.com.br/confere/ultimas-noticias/2025/05/27/post-falso-simula-campanha-ajuda-dudu-golpe.htm,pt,2025-05-27,campanha,2026-06-03T00:40:15.355960+00:00,factcheckexplorer,query_campanha.csv,55,,,,
2138777ae9183a90,A apresentadora afirma que o presidente Luiz Inácio Lula da Silva (PT) teria ficado incomodado com comentários do papa Leão 14 sobre ele.,a apresentadora afirma que o presidente luiz inacio lula da silva pt teria ficado incomodado com comentarios do papa leao 14 sobre ele,A APRESENTADORA AFIRMA QUE O PRESIDENTE LUIZ INACIO LULA DA SILVA PT TERIA FICADO INCOMODADO COM COMENTARIOS DO PAPA LEAO 14 SOBRE ELE,FALSO,FALSO,false,UOL Notícias,https://noticias.uol.com.br/comprova/ultimas-noticias/2025/05/22/video-usa-ia-para-simular-critica-do-papa-a-lula-no-jornal-nacional.htm,https://noticias.uol.com.br/comprova/ultimas-noticias/2025/05/22/video-usa-ia-para-simular-critica-do-papa-a-lula-no-jornal-nacional.htm,pt,2025-05-22,pt,2026-06-03T00:40:15.355960+00:00,factcheckexplorer,query_pt.csv,17,,,,
01813a48b82a37fe,"Ajude Isabela. A pequena Isabela sofre todos os dias com dores intensas causadas por uma doença rara na pele chamada Epidermólise Bolhosa, que forma bolhas e provoca a perda de até 80% da pele.",ajude isabela a pequena isabela sofre todos os dias com dores intensas causadas por uma doenca rara na pele chamada epidermolise bolhosa que forma bolhas e provoca a perda de ate 80 da pele,AJUDE ISABELA A PEQUENA ISABELA SOFRE TODOS OS DIAS COM DORES INTENSAS CAUSADAS POR UMA DOENCA RARA NA PELE CHAMADA EPIDERMOLISE BOLHOSA QUE FORMA BOLHAS E PROVOCA A PERDA DE ATE 80 DA PELE,FALSO,FALSO,false,UOL Notícias,https://noticias.uol.com.br/confere/ultimas-noticias/2025/05/20/campanha-doacao-menina-isabela-falso.htm,https://noticias.uol.com.br/confere/ultimas-noticias/2025/05/20/campanha-doacao-menina-isabela-falso.htm,pt,2025-05-20,campanha,2026-06-03T00:40:15.355960+00:00,factcheckexplorer,query_campanha.csv,9,,,,
40bf96bb77a32f06,"O deputado federal Lindbergh Farias (PT-RJ) seria o mandante da facada contra Jair Bolsonaro (PL) em 2018, cometida por Adélio Bispo de Oliveira",o deputado federal lindbergh farias pt rj seria o mandante da facada contra jair bolsonaro pl em 2018 cometida por adelio bispo de oliveira,O DEPUTADO FEDERAL LINDBERGH FARIAS PT RJ SERIA O MANDANTE DA FACADA CONTRA JAIR BOLSONARO PL EM 2018 COMETIDA POR ADELIO BISPO DE OLIVEIRA,FALSO,FALSO,false,UOL Notícias,https://noticias.uol.com.br/comprova/ultimas-noticias/2025/08/04/adelio-atacou-bolsonaro-sem-auxilio-externo-concluiram-investigadores.htm,https://noticias.uol.com.br/comprova/ultimas-noticias/2025/08/04/adelio-atacou-bolsonaro-sem-auxilio-externo-concluiram-investigadores.htm,pt,2025-04-08,pt,2026-06-03T00:40:15.355960+00:00,factcheckexplorer,query_pt.csv,13,,,,
49d81aecfb138ad4,IPVA para as bikes. Lula e Haddad estudam emplacar bicicletas para cobrar IPVA,ipva para as bikes lula e haddad estudam emplacar bicicletas para cobrar ipva,IPVA PARA AS BIKES LULA E HADDAD ESTUDAM EMPLACAR BICICLETAS PARA COBRAR IPVA,FALSO,FALSO,false,UOL Notícias,https://noticias.uol.com.br/confere/ultimas-noticias/2025/07/02/governo-federal-criacao-ipva-bicicletas-falso.htm,https://noticias.uol.com.br/confere/ultimas-noticias/2025/07/02/governo-federal-criacao-ipva-bicicletas-falso.htm,pt,2025-02-07,lula,2026-06-03T00:40:15.355960+00:00,factcheckexplorer,query_lula.csv,194,,,,
a72244fcf99037f2,"""Lula manda resposta afiada para os Estados Unidos""",lula manda resposta afiada para os estados unidos,LULA MANDA RESPOSTA AFIADA PARA OS ESTADOS UNIDOS,FALSO,FALSO,false,UOL Notícias,https://noticias.uol.com.br/confere/ultimas-noticias/2025/01/27/lula-resposta-trump-falso.htm,https://noticias.uol.com.br/confere/ultimas-noticias/2025/01/27/lula-resposta-trump-falso.htm,pt,2025-01-27,lula,2026-06-03T00:40:15.355960+00:00,factcheckexplorer,query_lula.csv,236,,,,
4d7de11cd54677a8,"Moraes levaria US$ 50 milhões para fraudar eleição, segundo órgão de inteligência Americana",moraes levaria us 50 milhoes para fraudar eleicao segundo orgao de inteligencia americana,MORAES LEVARIA US 50 MILHOES PARA FRAUDAR ELEICAO SEGUNDO ORGAO DE INTELIGENCIA AMERICANA,FALSO,FALSO,false,UOL Notícias,https://noticias.uol.com.br/confere/ultimas-noticias/2024/12/13/nao-foi-orgao-de-inteligencia-dos-eua-moraes-ganhava-para-fraudar-eleicoes.htm,https://noticias.uol.com.br/confere/ultimas-noticias/2024/12/13/nao-foi-orgao-de-inteligencia-dos-eua-moraes-ganhava-para-fraudar-eleicoes.htm,pt,2024-12-13,eleição,2026-06-03T00:40:15.355960+00:00,factcheckexplorer,query_eleicao.csv,51,,,,
a516bab1ce5bf38c,Felipe Neto postou preços em dezembro de 2022 para comparar governo Bolsonaro com o de Lula,felipe neto postou precos em dezembro de 2022 para comparar governo bolsonaro com o de lula,FELIPE NETO POSTOU PRECOS EM DEZEMBRO DE 2022 PARA COMPARAR GOVERNO BOLSONARO COM O DE LULA,FALSO,FALSO,false,UOL Notícias,https://noticias.uol.com.br/confere/ultimas-noticias/2024/12/12/felipe-neto-precos-bolsonaro-lula.htm,https://noticias.uol.com.br/confere/ultimas-noticias/2024/12/12/felipe-neto-precos-bolsonaro-lula.htm,pt,2024-12-12,bolsonaro,2026-06-03T00:40:15.355960+00:00,factcheckexplorer,query_bolsonaro.csv,187,,,,
2c730588fd936c25,OLHA O PILANTRA REINAUGURANDO A CHEGADA DAS AGUAS DO RIO SÃO FRANCISCO QUE O BOLSONARO JÁ INAUGUROU EM 2022,olha o pilantra reinaugurando a chegada das aguas do rio sao francisco que o bolsonaro ja inaugurou em 2022,OLHA O PILANTRA REINAUGURANDO A CHEGADA DAS AGUAS DO RIO SAO FRANCISCO QUE O BOLSONARO JA INAUGUROU EM 2022,FALSO,FALSO,false,UOL Notícias,https://noticias.uol.com.br/comprova/ultimas-noticias/2024/04/12/lula-nao-inaugurou-obra-da-transposicao-ja-inaugurada-por-bolsonaro.htm,https://noticias.uol.com.br/comprova/ultimas-noticias/2024/04/12/lula-nao-inaugurou-obra-da-transposicao-ja-inaugurada-por-bolsonaro.htm,pt,2024-12-04,bolsonaro,2026-06-03T00:40:15.355960+00:00,factcheckexplorer,query_bolsonaro.csv,197,,,,
39ad06270c928cd0,Caixa Econômica Federal foi à falência por responsabilidade do presidente Lula (PT),caixa economica federal foi a falencia por responsabilidade do presidente lula pt,CAIXA ECONOMICA FEDERAL FOI A FALENCIA POR RESPONSABILIDADE DO PRESIDENTE LULA PT,FALSO,FALSO,false,UOL Notícias,https://noticias.uol.com.br/comprova/ultimas-noticias/2024/11/22/saiba-o-que-mudou-no-financiamento-da-caixa-e-o-que-isso-diz-sobre-o-banco.htm,https://noticias.uol.com.br/comprova/ultimas-noticias/2024/11/22/saiba-o-que-mudou-no-financiamento-da-caixa-e-o-que-isso-diz-sobre-o-banco.htm,pt,2024-11-22,pt,2026-06-03T00:40:15.355960+00:00,factcheckexplorer,query_pt.csv,26,,,,
201eba1fd9b8c601,Mal começou as votações e Pablo Marçal foi desmascarado ele assinou o documento falsificado Foi diretamente para o xilindró lá ele vai ver o sol nascer quadrado,mal comecou as votacoes e pablo marcal foi desmascarado ele assinou o documento falsificado foi diretamente para o xilindro la ele vai ver o sol nascer quadrado,MAL COMECOU AS VOTACOES E PABLO MARCAL FOI DESMASCARADO ELE ASSINOU O DOCUMENTO FALSIFICADO FOI DIRETAMENTE PARA O XILINDRO LA ELE VAI VER O SOL NASCER QUADRADO,FALSO,FALSO,false,UOL Notícias,https://noticias.uol.com.br/confere/ultimas-noticias/2024/10/11/marcal-preso-primeiro-turno-laudo-falso-boulos.htm,https://noticias.uol.com.br/confere/ultimas-noticias/2024/10/11/marcal-preso-primeiro-turno-laudo-falso-boulos.htm,pt,2024-11-10,voto,2026-06-03T00:40:15.355960+00:00,factcheckexplorer,query_voto.csv,23,,,,
528f63ebcca6f79f,"O momento exato que, em apenas uma atualização, o Boulos sobe 2% na apuração dos votos, este comportamento parece suspeito e deve ser apurado",o momento exato que em apenas uma atualizacao o boulos sobe 2 na apuracao dos votos este comportamento parece suspeito e deve ser apurado,O MOMENTO EXATO QUE EM APENAS UMA ATUALIZACAO O BOULOS SOBE 2 NA APURACAO DOS VOTOS ESTE COMPORTAMENTO PARECE SUSPEITO E DEVE SER APURADO,FALSO,FALSO,false,UOL Notícias,https://noticias.uol.com.br/confere/ultimas-noticias/2024/10/11/e-falso-que-boulos-subiu-2-em-apenas-uma-atualizacao-da-apuracao.htm,https://noticias.uol.com.br/confere/ultimas-noticias/2024/10/11/e-falso-que-boulos-subiu-2-em-apenas-uma-atualizacao-da-apuracao.htm,pt,2024-11-10,voto,2026-06-03T00:40:15.355960+00:00,factcheckexplorer,query_voto.csv,22,,,,
08f121ae2d2291c8,PT só venceu a disputa para prefeitura em 46 municípios,pt so venceu a disputa para prefeitura em 46 municipios,PT SO VENCEU A DISPUTA PARA PREFEITURA EM 46 MUNICIPIOS,FALSO,FALSO,false,UOL Notícias,https://noticias.uol.com.br/comprova/ultimas-noticias/2024/10/11/pt-conquistou-248-prefeituras-em-2024-e-nao-46-como-alega-post.htm,https://noticias.uol.com.br/comprova/ultimas-noticias/2024/10/11/pt-conquistou-248-prefeituras-em-2024-e-nao-46-como-alega-post.htm,pt,2024-11-10,eleicoes 2024 | pt | tudo sobre eleicoes municipais 2024,2026-06-03T00:40:15.355960+00:00,factcheckexplorer,query_eleicoes_2024.csv | query_pt.csv | query_tudo_sobre_eleicoes_municipais_2024.csv,8 | 29 | 1,,,,
b892dbddb62fffba,SENADO APROVA PROJETO DE ZECA DIRCEU (PT) QUE PERMITE GOVERNO NÃO PAGAR O PISO DA ENFERMAGEM,senado aprova projeto de zeca dirceu pt que permite governo nao pagar o piso da enfermagem,SENADO APROVA PROJETO DE ZECA DIRCEU PT QUE PERMITE GOVERNO NAO PAGAR O PISO DA ENFERMAGEM,FALSO,FALSO,false,UOL Notícias,https://noticias.uol.com.br/confere/ultimas-noticias/2024/01/11/e-falso-que-senado-aprovou-projeto-de-lei-para-nao-pagar-piso-de-enfermagem.htm,https://noticias.uol.com.br/confere/ultimas-noticias/2024/01/11/e-falso-que-senado-aprovou-projeto-de-lei-para-nao-pagar-piso-de-enfermagem.htm,pt,2024-11-01,pt,2026-06-03T00:40:15.355960+00:00,factcheckexplorer,query_pt.csv,69,,,,
d4eb5a85aa8dceb4,Marçal ficou 1 hora e 9 minutos sem receber um voto! Matematicamente impossível. Este é o Brasil. Um circo. Ou o Brasil destrói essas urnas... ou nosso fim está bem próximo.,marcal ficou 1 hora e 9 minutos sem receber um voto matematicamente impossivel este e o brasil um circo ou o brasil destroi essas urnas ou nosso fim esta bem proximo,MARCAL FICOU 1 HORA E 9 MINUTOS SEM RECEBER UM VOTO MATEMATICAMENTE IMPOSSIVEL ESTE E O BRASIL UM CIRCO OU O BRASIL DESTROI ESSAS URNAS OU NOSSO FIM ESTA BEM PROXIMO,FALSO,FALSO,false,UOL Notícias,https://noticias.uol.com.br/confere/ultimas-noticias/2024/10/31/falso-pablo-marcal-1h-sem-voto.htm,https://noticias.uol.com.br/confere/ultimas-noticias/2024/10/31/falso-pablo-marcal-1h-sem-voto.htm,pt,2024-10-31,urna,2026-06-03T00:40:15.355960+00:00,factcheckexplorer,query_urna.csv,27,,,,
84b2c21f28d508fa,O sistema trocou mais de mil urnas nesse segundo turno em Fortaleza. Por que o sistema trocou mais de mil urnas?,o sistema trocou mais de mil urnas nesse segundo turno em fortaleza por que o sistema trocou mais de mil urnas,O SISTEMA TROCOU MAIS DE MIL URNAS NESSE SEGUNDO TURNO EM FORTALEZA POR QUE O SISTEMA TROCOU MAIS DE MIL URNAS,FALSO,FALSO,false,UOL Notícias,https://noticias.uol.com.br/confere/ultimas-noticias/2024/10/30/ce-tres-urnas-foram-substituidas-no-segundo-turno-e-nao-mil-em-fortaleza.htm,https://noticias.uol.com.br/confere/ultimas-noticias/2024/10/30/ce-tres-urnas-foram-substituidas-no-segundo-turno-e-nao-mil-em-fortaleza.htm,pt,2024-10-30,urna,2026-06-03T00:40:15.355960+00:00,factcheckexplorer,query_urna.csv,29,,,,
dd5268badf31ea5d,6 mil urnas foram trocadas em Fortaleza,6 mil urnas foram trocadas em fortaleza,6 MIL URNAS FORAM TROCADAS EM FORTALEZA,FALSO,FALSO,false,UOL Notícias,https://noticias.uol.com.br/confere/ultimas-noticias/2024/10/27/e-falso-que-seis-mil-urnas-foram-substituidas-em-fortaleza.htm,https://noticias.uol.com.br/confere/ultimas-noticias/2024/10/27/e-falso-que-seis-mil-urnas-foram-substituidas-em-fortaleza.htm,pt,2024-10-27,urna,2026-06-03T00:40:15.355960+00:00,factcheckexplorer,query_urna.csv,28,,,,
