record_id,claim_text,claim_text_normalized,model_text,rating,verdict_text,rating_label,publisher,review_url,review_url_normalized,language,review_date,source_keyword,collected_at,source_tool,raw_source_file,raw_row_index,review_title,review_title_normalized,claim_date,topic
2946941768035567,"Com foco nas Eleições Gerais de 2026, o Tribunal aprovou alterações na resolução que trata da propaganda eleitoral para regulamentar, entre outros pontos, o uso de inteligência artificial (IA) pelos partidos, candidatos e provedores de internet. .",com foco nas eleicoes gerais de 2026 o tribunal aprovou alteracoes na resolucao que trata da propaganda eleitoral para regulamentar entre outros pontos o uso de inteligencia artificial ia pelos partidos candidatos e provedores de internet,COM FOCO NAS ELEICOES GERAIS DE 2026 O TRIBUNAL APROVOU ALTERACOES NA RESOLUCAO QUE TRATA DA PROPAGANDA ELEITORAL PARA REGULAMENTAR ENTRE OUTROS PONTOS O USO DE INTELIGENCIA ARTIFICIAL IA PELOS PARTIDOS CANDIDATOS E PROVEDORES DE INTERNET POR DENTRO DAS ELEICOES CONHECA AS REGRAS SOBRE USO DE IA NA CAMPANHA ELEITORAL DE 2026,VERDADEIRO,VERDADEIRO,true,Tribunal Superior Eleitoral,https://tse.jus.br/comunicacao/noticias/2026/Abril/por-dentro-das-eleicoes-conheca-as-regras-sobre-uso-de-ia-na-campanha-eleitoral-de-2026,https://tse.jus.br/comunicacao/noticias/2026/Abril/por-dentro-das-eleicoes-conheca-as-regras-sobre-uso-de-ia-na-campanha-eleitoral-de-2026,pt,2026-04-10,uso de inteligência artificial campanha eleitoral,2026-06-12T16:50:47.272847+00:00,trusted_true_sources,https://www.tse.jus.br/comunicacao/noticias/2026/Abril/por-dentro-das-eleicoes-conheca-as-regras-sobre-uso-de-ia-na-campanha-eleitoral-de-2026,6,Por Dentro das Eleições: conheça as regras sobre uso de IA na campanha eleitoral de 2026,por dentro das eleicoes conheca as regras sobre uso de ia na campanha eleitoral de 2026,2026-04-10,campanha_regras_ia
113ef5d3b20fece6,A regulamentação tem a finalidade de impedir a propagação de conteúdos fabricados ou manipulados para difundir fatos notoriamente inverídicos ou descontextualizados que possam causar danos ao equilíbrio das eleições ou à integridade do processo eleitoral.,a regulamentacao tem a finalidade de impedir a propagacao de conteudos fabricados ou manipulados para difundir fatos notoriamente inveridicos ou descontextualizados que possam causar danos ao equilibrio das eleicoes ou a integridade do processo eleitoral,A REGULAMENTACAO TEM A FINALIDADE DE IMPEDIR A PROPAGACAO DE CONTEUDOS FABRICADOS OU MANIPULADOS PARA DIFUNDIR FATOS NOTORIAMENTE INVERIDICOS OU DESCONTEXTUALIZADOS QUE POSSAM CAUSAR DANOS AO EQUILIBRIO DAS ELEICOES OU A INTEGRIDADE DO PROCESSO ELEITORAL POR DENTRO DAS ELEICOES CONHECA AS REGRAS SOBRE USO DE IA NA CAMPANHA ELEITORAL DE 2026,VERDADEIRO,VERDADEIRO,true,Tribunal Superior Eleitoral,https://tse.jus.br/comunicacao/noticias/2026/Abril/por-dentro-das-eleicoes-conheca-as-regras-sobre-uso-de-ia-na-campanha-eleitoral-de-2026,https://tse.jus.br/comunicacao/noticias/2026/Abril/por-dentro-das-eleicoes-conheca-as-regras-sobre-uso-de-ia-na-campanha-eleitoral-de-2026,pt,2026-04-10,uso de inteligência artificial campanha eleitoral,2026-06-12T16:50:47.272847+00:00,trusted_true_sources,https://www.tse.jus.br/comunicacao/noticias/2026/Abril/por-dentro-das-eleicoes-conheca-as-regras-sobre-uso-de-ia-na-campanha-eleitoral-de-2026,7,Por Dentro das Eleições: conheça as regras sobre uso de IA na campanha eleitoral de 2026,por dentro das eleicoes conheca as regras sobre uso de ia na campanha eleitoral de 2026,2026-04-10,campanha_regras_ia
2458f0bea56399fc,"Com as regras, o TSE também busca combater o uso de deepfake para prejudicar ou favorecer determinada candidatura. .",com as regras o tse tambem busca combater o uso de deepfake para prejudicar ou favorecer determinada candidatura,COM AS REGRAS O TSE TAMBEM BUSCA COMBATER O USO DE DEEPFAKE PARA PREJUDICAR OU FAVORECER DETERMINADA CANDIDATURA POR DENTRO DAS ELEICOES CONHECA AS REGRAS SOBRE USO DE IA NA CAMPANHA ELEITORAL DE 2026,VERDADEIRO,VERDADEIRO,true,Tribunal Superior Eleitoral,https://tse.jus.br/comunicacao/noticias/2026/Abril/por-dentro-das-eleicoes-conheca-as-regras-sobre-uso-de-ia-na-campanha-eleitoral-de-2026,https://tse.jus.br/comunicacao/noticias/2026/Abril/por-dentro-das-eleicoes-conheca-as-regras-sobre-uso-de-ia-na-campanha-eleitoral-de-2026,pt,2026-04-10,uso de inteligência artificial campanha eleitoral,2026-06-12T16:50:47.272847+00:00,trusted_true_sources,https://www.tse.jus.br/comunicacao/noticias/2026/Abril/por-dentro-das-eleicoes-conheca-as-regras-sobre-uso-de-ia-na-campanha-eleitoral-de-2026,8,Por Dentro das Eleições: conheça as regras sobre uso de IA na campanha eleitoral de 2026,por dentro das eleicoes conheca as regras sobre uso de ia na campanha eleitoral de 2026,2026-04-10,campanha_regras_ia
05cafbe2fc1348e6,"Entre as novidades para as Eleições 2026, está a proibição de publicação e republicação, mesmo que de forma gratuita, bem como de impulsionamento pago de novos conteúdos sintéticos produzidos ou alterados por IA no período compreendido entre as 72 horas que antecedem o pleito e as 24 horas depois das eleições. .",entre as novidades para as eleicoes 2026 esta a proibicao de publicacao e republicacao mesmo que de forma gratuita bem como de impulsionamento pago de novos conteudos sinteticos produzidos ou alterados por ia no periodo compreendido entre as 72 horas que antecedem o pleito e as 24 horas depois das eleicoes,ENTRE AS NOVIDADES PARA AS ELEICOES 2026 ESTA A PROIBICAO DE PUBLICACAO E REPUBLICACAO MESMO QUE DE FORMA GRATUITA BEM COMO DE IMPULSIONAMENTO PAGO DE NOVOS CONTEUDOS SINTETICOS PRODUZIDOS OU ALTERADOS POR IA NO PERIODO COMPREENDIDO ENTRE AS 72 HORAS QUE ANTECEDEM O PLEITO E AS 24 HORAS DEPOIS DAS ELEICOES POR DENTRO DAS ELEICOES CONHECA AS REGRAS SOBRE USO DE IA NA CAMPANHA ELEITORAL DE 2026,VERDADEIRO,VERDADEIRO,true,Tribunal Superior Eleitoral,https://tse.jus.br/comunicacao/noticias/2026/Abril/por-dentro-das-eleicoes-conheca-as-regras-sobre-uso-de-ia-na-campanha-eleitoral-de-2026,https://tse.jus.br/comunicacao/noticias/2026/Abril/por-dentro-das-eleicoes-conheca-as-regras-sobre-uso-de-ia-na-campanha-eleitoral-de-2026,pt,2026-04-10,uso de inteligência artificial campanha eleitoral,2026-06-12T16:50:47.272847+00:00,trusted_true_sources,https://www.tse.jus.br/comunicacao/noticias/2026/Abril/por-dentro-das-eleicoes-conheca-as-regras-sobre-uso-de-ia-na-campanha-eleitoral-de-2026,9,Por Dentro das Eleições: conheça as regras sobre uso de IA na campanha eleitoral de 2026,por dentro das eleicoes conheca as regras sobre uso de ia na campanha eleitoral de 2026,2026-04-10,campanha_regras_ia
3f40b089d82a0b8f,"As regras estão previstas no artigo 9º-B da Resolução nº 23.610/TSE, de 18 de dezembro de 2019 , que trata da desinformação na propaganda eleitoral, com as alterações promovidas pela Resolução nº 23.755, de 2 de março de 2026 . .",as regras estao previstas no artigo 9o b da resolucao no 23 610 tse de 18 de dezembro de 2019 que trata da desinformacao na propaganda eleitoral com as alteracoes promovidas pela resolucao no 23 755 de 2 de marco de 2026,AS REGRAS ESTAO PREVISTAS NO ARTIGO 9O B DA RESOLUCAO NO 23 610 TSE DE 18 DE DEZEMBRO DE 2019 QUE TRATA DA DESINFORMACAO NA PROPAGANDA ELEITORAL COM AS ALTERACOES PROMOVIDAS PELA RESOLUCAO NO 23 755 DE 2 DE MARCO DE 2026 POR DENTRO DAS ELEICOES CONHECA AS REGRAS SOBRE USO DE IA NA CAMPANHA ELEITORAL DE 2026,VERDADEIRO,VERDADEIRO,true,Tribunal Superior Eleitoral,https://tse.jus.br/comunicacao/noticias/2026/Abril/por-dentro-das-eleicoes-conheca-as-regras-sobre-uso-de-ia-na-campanha-eleitoral-de-2026,https://tse.jus.br/comunicacao/noticias/2026/Abril/por-dentro-das-eleicoes-conheca-as-regras-sobre-uso-de-ia-na-campanha-eleitoral-de-2026,pt,2026-04-10,uso de inteligência artificial campanha eleitoral,2026-06-12T16:50:47.274851+00:00,trusted_true_sources,https://www.tse.jus.br/comunicacao/noticias/2026/Abril/por-dentro-das-eleicoes-conheca-as-regras-sobre-uso-de-ia-na-campanha-eleitoral-de-2026,10,Por Dentro das Eleições: conheça as regras sobre uso de IA na campanha eleitoral de 2026,por dentro das eleicoes conheca as regras sobre uso de ia na campanha eleitoral de 2026,2026-04-10,campanha_regras_ia
1663c7c4d1ea475f,"Guardião da democracia, o TSE tem, entre suas atribuições, a de garantir a realização de eleições seguras, transparentes e limpas.",guardiao da democracia o tse tem entre suas atribuicoes a de garantir a realizacao de eleicoes seguras transparentes e limpas,GUARDIAO DA DEMOCRACIA O TSE TEM ENTRE SUAS ATRIBUICOES A DE GARANTIR A REALIZACAO DE ELEICOES SEGURAS TRANSPARENTES E LIMPAS POR DENTRO DAS ELEICOES CONHECA AS REGRAS SOBRE USO DE IA NA CAMPANHA ELEITORAL DE 2026,VERDADEIRO,VERDADEIRO,true,Tribunal Superior Eleitoral,https://tse.jus.br/comunicacao/noticias/2026/Abril/por-dentro-das-eleicoes-conheca-as-regras-sobre-uso-de-ia-na-campanha-eleitoral-de-2026,https://tse.jus.br/comunicacao/noticias/2026/Abril/por-dentro-das-eleicoes-conheca-as-regras-sobre-uso-de-ia-na-campanha-eleitoral-de-2026,pt,2026-04-10,uso de inteligência artificial campanha eleitoral,2026-06-12T16:50:47.274851+00:00,trusted_true_sources,https://www.tse.jus.br/comunicacao/noticias/2026/Abril/por-dentro-das-eleicoes-conheca-as-regras-sobre-uso-de-ia-na-campanha-eleitoral-de-2026,11,Por Dentro das Eleições: conheça as regras sobre uso de IA na campanha eleitoral de 2026,por dentro das eleicoes conheca as regras sobre uso de ia na campanha eleitoral de 2026,2026-04-10,campanha_regras_ia
bdd5725f6deb1f4a,"O Tribunal tem cumprido essa missão há 94 anos e, desde 1996, proporciona ao eleitorado a oportunidade de participar da maior eleição informatizada do mundo, viabilizada pela urna eletrônica.",o tribunal tem cumprido essa missao ha 94 anos e desde 1996 proporciona ao eleitorado a oportunidade de participar da maior eleicao informatizada do mundo viabilizada pela urna eletronica,O TRIBUNAL TEM CUMPRIDO ESSA MISSAO HA 94 ANOS E DESDE 1996 PROPORCIONA AO ELEITORADO A OPORTUNIDADE DE PARTICIPAR DA MAIOR ELEICAO INFORMATIZADA DO MUNDO VIABILIZADA PELA URNA ELETRONICA POR DENTRO DAS ELEICOES CONHECA AS REGRAS SOBRE USO DE IA NA CAMPANHA ELEITORAL DE 2026,VERDADEIRO,VERDADEIRO,true,Tribunal Superior Eleitoral,https://tse.jus.br/comunicacao/noticias/2026/Abril/por-dentro-das-eleicoes-conheca-as-regras-sobre-uso-de-ia-na-campanha-eleitoral-de-2026,https://tse.jus.br/comunicacao/noticias/2026/Abril/por-dentro-das-eleicoes-conheca-as-regras-sobre-uso-de-ia-na-campanha-eleitoral-de-2026,pt,2026-04-10,uso de inteligência artificial campanha eleitoral,2026-06-12T16:50:47.274851+00:00,trusted_true_sources,https://www.tse.jus.br/comunicacao/noticias/2026/Abril/por-dentro-das-eleicoes-conheca-as-regras-sobre-uso-de-ia-na-campanha-eleitoral-de-2026,12,Por Dentro das Eleições: conheça as regras sobre uso de IA na campanha eleitoral de 2026,por dentro das eleicoes conheca as regras sobre uso de ia na campanha eleitoral de 2026,2026-04-10,campanha_regras_ia
98a164f845b4af90,"Contudo, essa missão se torna mais fácil se houver o apoio de partidos, candidatos, eleitores e demais envolvidos no processo eleitoral. .",contudo essa missao se torna mais facil se houver o apoio de partidos candidatos eleitores e demais envolvidos no processo eleitoral,CONTUDO ESSA MISSAO SE TORNA MAIS FACIL SE HOUVER O APOIO DE PARTIDOS CANDIDATOS ELEITORES E DEMAIS ENVOLVIDOS NO PROCESSO ELEITORAL POR DENTRO DAS ELEICOES CONHECA AS REGRAS SOBRE USO DE IA NA CAMPANHA ELEITORAL DE 2026,VERDADEIRO,VERDADEIRO,true,Tribunal Superior Eleitoral,https://tse.jus.br/comunicacao/noticias/2026/Abril/por-dentro-das-eleicoes-conheca-as-regras-sobre-uso-de-ia-na-campanha-eleitoral-de-2026,https://tse.jus.br/comunicacao/noticias/2026/Abril/por-dentro-das-eleicoes-conheca-as-regras-sobre-uso-de-ia-na-campanha-eleitoral-de-2026,pt,2026-04-10,uso de inteligência artificial campanha eleitoral,2026-06-12T16:50:47.274851+00:00,trusted_true_sources,https://www.tse.jus.br/comunicacao/noticias/2026/Abril/por-dentro-das-eleicoes-conheca-as-regras-sobre-uso-de-ia-na-campanha-eleitoral-de-2026,13,Por Dentro das Eleições: conheça as regras sobre uso de IA na campanha eleitoral de 2026,por dentro das eleicoes conheca as regras sobre uso de ia na campanha eleitoral de 2026,2026-04-10,campanha_regras_ia
463008d2d13716aa,"No dia 4 de outubro, eleitores elegerão candidatos para seis cargos em disputa",no dia 4 de outubro eleitores elegerao candidatos para seis cargos em disputa,NO DIA 4 DE OUTUBRO ELEITORES ELEGERAO CANDIDATOS PARA SEIS CARGOS EM DISPUTA ELEICOES 2026 CONHECA A ORDEM DE VOTACAO NA URNA ELETRONICA,VERDADEIRO,VERDADEIRO,true,Tribunal Superior Eleitoral,https://tse.jus.br/comunicacao/noticias/2026/Marco/eleicoes-2026-conheca-a-ordem-de-votacao-na-urna-eletronica,https://tse.jus.br/comunicacao/noticias/2026/Marco/eleicoes-2026-conheca-a-ordem-de-votacao-na-urna-eletronica,pt,2026-03-17,ordem de votação urna eletrônica,2026-06-12T16:50:45.917825+00:00,trusted_true_sources,https://www.tse.jus.br/comunicacao/noticias/2026/Marco/eleicoes-2026-conheca-a-ordem-de-votacao-na-urna-eletronica,0,Eleições 2026: conheça a ordem de votação na urna eletrônica,eleicoes 2026 conheca a ordem de votacao na urna eletronica,2026-03-17,votacao
303d751e8634ee50,Eleições 2026: conheça a ordem de votação na urna eletrônica — Tribunal Superior Eleitoral Acessibilidade .,eleicoes 2026 conheca a ordem de votacao na urna eletronica tribunal superior eleitoral acessibilidade,ELEICOES 2026 CONHECA A ORDEM DE VOTACAO NA URNA ELETRONICA TRIBUNAL SUPERIOR ELEITORAL ACESSIBILIDADE ELEICOES 2026 CONHECA A ORDEM DE VOTACAO NA URNA ELETRONICA,VERDADEIRO,VERDADEIRO,true,Tribunal Superior Eleitoral,https://tse.jus.br/comunicacao/noticias/2026/Marco/eleicoes-2026-conheca-a-ordem-de-votacao-na-urna-eletronica,https://tse.jus.br/comunicacao/noticias/2026/Marco/eleicoes-2026-conheca-a-ordem-de-votacao-na-urna-eletronica,pt,2026-03-17,ordem de votação urna eletrônica,2026-06-12T16:50:45.917825+00:00,trusted_true_sources,https://www.tse.jus.br/comunicacao/noticias/2026/Marco/eleicoes-2026-conheca-a-ordem-de-votacao-na-urna-eletronica,1,Eleições 2026: conheça a ordem de votação na urna eletrônica,eleicoes 2026 conheca a ordem de votacao na urna eletronica,2026-03-17,votacao
3c9926ccb9a6aea7,Aplicativo e-Título . . mais sobre Serviços eleitorais . . . . . . . . .,aplicativo e titulo mais sobre servicos eleitorais,APLICATIVO E TITULO MAIS SOBRE SERVICOS ELEITORAIS ELEICOES 2026 CONHECA A ORDEM DE VOTACAO NA URNA ELETRONICA,VERDADEIRO,VERDADEIRO,true,Tribunal Superior Eleitoral,https://tse.jus.br/comunicacao/noticias/2026/Marco/eleicoes-2026-conheca-a-ordem-de-votacao-na-urna-eletronica,https://tse.jus.br/comunicacao/noticias/2026/Marco/eleicoes-2026-conheca-a-ordem-de-votacao-na-urna-eletronica,pt,2026-03-17,ordem de votação urna eletrônica,2026-06-12T16:50:45.917825+00:00,trusted_true_sources,https://www.tse.jus.br/comunicacao/noticias/2026/Marco/eleicoes-2026-conheca-a-ordem-de-votacao-na-urna-eletronica,2,Eleições 2026: conheça a ordem de votação na urna eletrônica,eleicoes 2026 conheca a ordem de votacao na urna eletronica,2026-03-17,votacao
75da97c19662cdc1,"Eleições 2026: conheça a ordem de votação na urna eletrônica No dia 4 de outubro, eleitores elegerão candidatos para seis cargos em disputa https://www.tse.jus.br/comunicacao/noticias/2026/Marco/eleicoes-2026-conheca-a-ordem-de-votacao-na-urna-eletronica https://www.tse.jus.br/@@site-logo/logo.jpg .",eleicoes 2026 conheca a ordem de votacao na urna eletronica no dia 4 de outubro eleitores elegerao candidatos para seis cargos em disputa https www tse jus br comunicacao noticias 2026 marco eleicoes 2026 conheca a ordem de votacao na urna eletronica https www tse jus br site logo logo jpg,ELEICOES 2026 CONHECA A ORDEM DE VOTACAO NA URNA ELETRONICA NO DIA 4 DE OUTUBRO ELEITORES ELEGERAO CANDIDATOS PARA SEIS CARGOS EM DISPUTA HTTPS WWW TSE JUS BR COMUNICACAO NOTICIAS 2026 MARCO ELEICOES 2026 CONHECA A ORDEM DE VOTACAO NA URNA ELETRONICA HTTPS WWW TSE JUS BR SITE LOGO LOGO JPG ELEICOES 2026 CONHECA A ORDEM DE VOTACAO NA URNA ELETRONICA,VERDADEIRO,VERDADEIRO,true,Tribunal Superior Eleitoral,https://tse.jus.br/comunicacao/noticias/2026/Marco/eleicoes-2026-conheca-a-ordem-de-votacao-na-urna-eletronica,https://tse.jus.br/comunicacao/noticias/2026/Marco/eleicoes-2026-conheca-a-ordem-de-votacao-na-urna-eletronica,pt,2026-03-17,ordem de votação urna eletrônica,2026-06-12T16:50:45.917825+00:00,trusted_true_sources,https://www.tse.jus.br/comunicacao/noticias/2026/Marco/eleicoes-2026-conheca-a-ordem-de-votacao-na-urna-eletronica,3,Eleições 2026: conheça a ordem de votação na urna eletrônica,eleicoes 2026 conheca a ordem de votacao na urna eletronica,2026-03-17,votacao
d98b76d01626e725,"Em outubro, mais de 155 milhões de brasileiras e brasileiros irão às urnas para eleger presidente da República, governadores, senadores, deputados federais e deputados estaduais e distritais.",em outubro mais de 155 milhoes de brasileiras e brasileiros irao as urnas para eleger presidente da republica governadores senadores deputados federais e deputados estaduais e distritais,EM OUTUBRO MAIS DE 155 MILHOES DE BRASILEIRAS E BRASILEIROS IRAO AS URNAS PARA ELEGER PRESIDENTE DA REPUBLICA GOVERNADORES SENADORES DEPUTADOS FEDERAIS E DEPUTADOS ESTADUAIS E DISTRITAIS ELEICOES 2026 CONHECA A ORDEM DE VOTACAO NA URNA ELETRONICA,VERDADEIRO,VERDADEIRO,true,Tribunal Superior Eleitoral,https://tse.jus.br/comunicacao/noticias/2026/Marco/eleicoes-2026-conheca-a-ordem-de-votacao-na-urna-eletronica,https://tse.jus.br/comunicacao/noticias/2026/Marco/eleicoes-2026-conheca-a-ordem-de-votacao-na-urna-eletronica,pt,2026-03-17,ordem de votação urna eletrônica,2026-06-12T16:50:45.917825+00:00,trusted_true_sources,https://www.tse.jus.br/comunicacao/noticias/2026/Marco/eleicoes-2026-conheca-a-ordem-de-votacao-na-urna-eletronica,4,Eleições 2026: conheça a ordem de votação na urna eletrônica,eleicoes 2026 conheca a ordem de votacao na urna eletronica,2026-03-17,votacao
51a27ca69f0101a2,"O 1º turno das Eleições Gerais de 2026 acontecerá no dia 4 de outubro, enquanto eventual 2º turno para as disputas majoritárias (presidente e governadores) está marcado para 25 de outubro. .",o 1o turno das eleicoes gerais de 2026 acontecera no dia 4 de outubro enquanto eventual 2o turno para as disputas majoritarias presidente e governadores esta marcado para 25 de outubro,O 1O TURNO DAS ELEICOES GERAIS DE 2026 ACONTECERA NO DIA 4 DE OUTUBRO ENQUANTO EVENTUAL 2O TURNO PARA AS DISPUTAS MAJORITARIAS PRESIDENTE E GOVERNADORES ESTA MARCADO PARA 25 DE OUTUBRO ELEICOES 2026 CONHECA A ORDEM DE VOTACAO NA URNA ELETRONICA,VERDADEIRO,VERDADEIRO,true,Tribunal Superior Eleitoral,https://tse.jus.br/comunicacao/noticias/2026/Marco/eleicoes-2026-conheca-a-ordem-de-votacao-na-urna-eletronica,https://tse.jus.br/comunicacao/noticias/2026/Marco/eleicoes-2026-conheca-a-ordem-de-votacao-na-urna-eletronica,pt,2026-03-17,ordem de votação urna eletrônica,2026-06-12T16:50:45.917825+00:00,trusted_true_sources,https://www.tse.jus.br/comunicacao/noticias/2026/Marco/eleicoes-2026-conheca-a-ordem-de-votacao-na-urna-eletronica,5,Eleições 2026: conheça a ordem de votação na urna eletrônica,eleicoes 2026 conheca a ordem de votacao na urna eletronica,2026-03-17,votacao
8f63e093cee1a056,"A votação começará às 8h e terminará às 17h, pelo horário de Brasília, em todos os estados e no Distrito Federal. .",a votacao comecara as 8h e terminara as 17h pelo horario de brasilia em todos os estados e no distrito federal,A VOTACAO COMECARA AS 8H E TERMINARA AS 17H PELO HORARIO DE BRASILIA EM TODOS OS ESTADOS E NO DISTRITO FEDERAL ELEICOES 2026 CONHECA A ORDEM DE VOTACAO NA URNA ELETRONICA,VERDADEIRO,VERDADEIRO,true,Tribunal Superior Eleitoral,https://tse.jus.br/comunicacao/noticias/2026/Marco/eleicoes-2026-conheca-a-ordem-de-votacao-na-urna-eletronica,https://tse.jus.br/comunicacao/noticias/2026/Marco/eleicoes-2026-conheca-a-ordem-de-votacao-na-urna-eletronica,pt,2026-03-17,ordem de votação urna eletrônica,2026-06-12T16:50:45.917825+00:00,trusted_true_sources,https://www.tse.jus.br/comunicacao/noticias/2026/Marco/eleicoes-2026-conheca-a-ordem-de-votacao-na-urna-eletronica,6,Eleições 2026: conheça a ordem de votação na urna eletrônica,eleicoes 2026 conheca a ordem de votacao na urna eletronica,2026-03-17,votacao
10890bbad25ede3a,"O eleitorado fará seis escolhas nas urnas, nesta ordem: . deputado federal; . deputado estadual (ou distrital, no caso do DF); . senador (primeira vaga); . senador (segunda vaga); . governador e vice-governador; e . presidente e vice-presidente da República. .",o eleitorado fara seis escolhas nas urnas nesta ordem deputado federal deputado estadual ou distrital no caso do df senador primeira vaga senador segunda vaga governador e vice governador e presidente e vice presidente da republica,O ELEITORADO FARA SEIS ESCOLHAS NAS URNAS NESTA ORDEM DEPUTADO FEDERAL DEPUTADO ESTADUAL OU DISTRITAL NO CASO DO DF SENADOR PRIMEIRA VAGA SENADOR SEGUNDA VAGA GOVERNADOR E VICE GOVERNADOR E PRESIDENTE E VICE PRESIDENTE DA REPUBLICA ELEICOES 2026 CONHECA A ORDEM DE VOTACAO NA URNA ELETRONICA,VERDADEIRO,VERDADEIRO,true,Tribunal Superior Eleitoral,https://tse.jus.br/comunicacao/noticias/2026/Marco/eleicoes-2026-conheca-a-ordem-de-votacao-na-urna-eletronica,https://tse.jus.br/comunicacao/noticias/2026/Marco/eleicoes-2026-conheca-a-ordem-de-votacao-na-urna-eletronica,pt,2026-03-17,ordem de votação urna eletrônica,2026-06-12T16:50:45.917825+00:00,trusted_true_sources,https://www.tse.jus.br/comunicacao/noticias/2026/Marco/eleicoes-2026-conheca-a-ordem-de-votacao-na-urna-eletronica,7,Eleições 2026: conheça a ordem de votação na urna eletrônica,eleicoes 2026 conheca a ordem de votacao na urna eletronica,2026-03-17,votacao
746e8236b83db964,"A votação será realizada pelo número da candidata, do candidato ou da legenda partidária, devendo constar, no painel da urna eletrônica, o nome, a fotografia, o cargo em disputa e a sigla do partido político, conforme o artigo 142 da Resolução TSE nº 23.751/2026 , que dispõe sobre os atos gerais do processo eleitoral para as Eleições 2026. .",a votacao sera realizada pelo numero da candidata do candidato ou da legenda partidaria devendo constar no painel da urna eletronica o nome a fotografia o cargo em disputa e a sigla do partido politico conforme o artigo 142 da resolucao tse no 23 751 2026 que dispoe sobre os atos gerais do processo eleitoral para as eleicoes 2026,A VOTACAO SERA REALIZADA PELO NUMERO DA CANDIDATA DO CANDIDATO OU DA LEGENDA PARTIDARIA DEVENDO CONSTAR NO PAINEL DA URNA ELETRONICA O NOME A FOTOGRAFIA O CARGO EM DISPUTA E A SIGLA DO PARTIDO POLITICO CONFORME O ARTIGO 142 DA RESOLUCAO TSE NO 23 751 2026 QUE DISPOE SOBRE OS ATOS GERAIS DO PROCESSO ELEITORAL PARA AS ELEICOES 2026 ELEICOES 2026 CONHECA A ORDEM DE VOTACAO NA URNA ELETRONICA,VERDADEIRO,VERDADEIRO,true,Tribunal Superior Eleitoral,https://tse.jus.br/comunicacao/noticias/2026/Marco/eleicoes-2026-conheca-a-ordem-de-votacao-na-urna-eletronica,https://tse.jus.br/comunicacao/noticias/2026/Marco/eleicoes-2026-conheca-a-ordem-de-votacao-na-urna-eletronica,pt,2026-03-17,ordem de votação urna eletrônica,2026-06-12T16:50:45.917825+00:00,trusted_true_sources,https://www.tse.jus.br/comunicacao/noticias/2026/Marco/eleicoes-2026-conheca-a-ordem-de-votacao-na-urna-eletronica,8,Eleições 2026: conheça a ordem de votação na urna eletrônica,eleicoes 2026 conheca a ordem de votacao na urna eletronica,2026-03-17,votacao
47cbc0b2668d3935,"Ao tomar posse na Presidência do TSE, Nunes Marques defende a vontade soberana do povo nas urnas . .",ao tomar posse na presidencia do tse nunes marques defende a vontade soberana do povo nas urnas,AO TOMAR POSSE NA PRESIDENCIA DO TSE NUNES MARQUES DEFENDE A VONTADE SOBERANA DO POVO NAS URNAS ELEICOES 2026 CONHECA A ORDEM DE VOTACAO NA URNA ELETRONICA,VERDADEIRO,VERDADEIRO,true,Tribunal Superior Eleitoral,https://tse.jus.br/comunicacao/noticias/2026/Marco/eleicoes-2026-conheca-a-ordem-de-votacao-na-urna-eletronica,https://tse.jus.br/comunicacao/noticias/2026/Marco/eleicoes-2026-conheca-a-ordem-de-votacao-na-urna-eletronica,pt,2026-03-17,ordem de votação urna eletrônica,2026-06-12T16:50:45.917825+00:00,trusted_true_sources,https://www.tse.jus.br/comunicacao/noticias/2026/Marco/eleicoes-2026-conheca-a-ordem-de-votacao-na-urna-eletronica,9,Eleições 2026: conheça a ordem de votação na urna eletrônica,eleicoes 2026 conheca a ordem de votacao na urna eletronica,2026-03-17,votacao
32c8bce2dd049faa,30 anos da urna eletrônica: Eleições 2024 foram o maior pleito informatizado do mundo . .,30 anos da urna eletronica eleicoes 2024 foram o maior pleito informatizado do mundo,30 ANOS DA URNA ELETRONICA ELEICOES 2024 FORAM O MAIOR PLEITO INFORMATIZADO DO MUNDO ELEICOES 2026 CONHECA A ORDEM DE VOTACAO NA URNA ELETRONICA,VERDADEIRO,VERDADEIRO,true,Tribunal Superior Eleitoral,https://tse.jus.br/comunicacao/noticias/2026/Marco/eleicoes-2026-conheca-a-ordem-de-votacao-na-urna-eletronica,https://tse.jus.br/comunicacao/noticias/2026/Marco/eleicoes-2026-conheca-a-ordem-de-votacao-na-urna-eletronica,pt,2026-03-17,ordem de votação urna eletrônica,2026-06-12T16:50:45.917825+00:00,trusted_true_sources,https://www.tse.jus.br/comunicacao/noticias/2026/Marco/eleicoes-2026-conheca-a-ordem-de-votacao-na-urna-eletronica,10,Eleições 2026: conheça a ordem de votação na urna eletrônica,eleicoes 2026 conheca a ordem de votacao na urna eletronica,2026-03-17,votacao
