Claim,Source Name,Source URL,Verdict,Review Publication Date,Image URL,Tags
Polícia Federal apreendeu malas de dinheiro em sede do PT na Bahia,Aos Fatos,https://www.aosfatos.org/noticias/pf-malas-dinheiro-vorcaro-pt/,falso,2026-05-29 07:00:00,https://encrypted-tbn3.gstatic.com/images?q=tbn:ANd9GcRWMXthQpnE2uTzvKkCUtXAZ_FLAk4prtqgbzyQBndcDr4quomH,"['Polícia Federal', 'Departamento de Polícia Federal', 'Partido dos Trabalhadores', 'Partido dos Trabalhadores', 'Dinheiro', 'Mala', 'Bahia', 'Polícia']"
"""BOMBA AGORA! Lula FLAGRADO com mala com MILHÕES do Vorcaro dentro da sede do PT? REVIRAVOLTA""",BOL - UOL,https://www.bol.uol.com.br/noticias/2026/05/27/falso-pf-flagra-lula-mala-dinheiro-vorcaro.amp.htm,Falso,2026-05-27 07:00:00,https://encrypted-tbn0.gstatic.com/images?q=tbn:ANd9GcRQ0mNAr076uVhf50TrAVZkeSJ0PUbMPHI-0WbXYS4HKzrjPFAc,"['Daniel Vorcaro', 'Luiz Inácio Lula da Silva', 'Partido dos Trabalhadores', 'Mala', 'Partido dos Trabalhadores']"
Alexandre Frota denuncia plano de bolsonaristas para atacar igrejas e culpar o PT antes das eleições,Estadão,https://www.estadao.com.br/estadao-verifica/declaracao-alexandre-frota-bolsonaristas-prejudicar-lula-falso/,Falso,2026-05-08 07:00:00,https://encrypted-tbn3.gstatic.com/images?q=tbn:ANd9GcQbs0xfUX3RSZ05mOTSJG5cYhijGLxmE_0HlJTtcIgD8opA3Xoq,"['Bolsonarismo', 'Partido dos Trabalhadores', 'Eleição', 'Partido dos Trabalhadores']"
Grupo de assessores do PT ganhou prêmio de R$ 120 milhões na Mega da Virada de 2025,Estadão,https://www.estadao.com.br/estadao-verifica/assessores-pt-mega-sena-120-milhoes-2019-enganoso/,Enganoso,2026-01-07 08:00:00,https://encrypted-tbn2.gstatic.com/images?q=tbn:ANd9GcRZoXmZ1089EHlPxKy5EqD9TD1eSPiP4Rg6Dljeil0nNBMqBr5n,"['Mega-Sena', 'Partido dos Trabalhadores', 'prémio', 'Partido dos Trabalhadores', '2025']"
"Funcionários do PT ganharam Mega da Virada de 2025 com prêmio acumulado de R$ 1,09 bilhão",UOL Notícias,https://noticias.uol.com.br/confere/ultimas-noticias/2026/01/07/assessores-do-pt-nao-ganharam-mega-da-virada-de-r-1-bi-noticia-e-de-2024.htm,Distorcido,2026-01-07 08:00:00,https://encrypted-tbn2.gstatic.com/images?q=tbn:ANd9GcTjUiSlv-eE27AR0nkX54t5T0RdUamW0s8a_1MIpdonoUk91D3A,"['Mega-Sena', 'Partido dos Trabalhadores', 'Partido dos Trabalhadores', 'Um bilhão', '2025']"
Grupo de assessores do PT ganhou R$ 120 milhões na Mega da Virada 2025,Aos Fatos,https://www.aosfatos.org/noticias/grupo-de-assessores-do-pt-nao-ganhou-premio-de-r-120-milhoes-na-ultima-mega-da-virada/,falso,2026-01-02 08:00:00,https://encrypted-tbn2.gstatic.com/images?q=tbn:ANd9GcQqFgAhY1XPkAgLC5pO26NQXa_jrTZpajJ74HUhm4ci55T2fPpD,"['Mega-Sena', 'Partido dos Trabalhadores', 'Partido dos Trabalhadores', '2025']"
"Venezuela ""começou a dedurar"" após a prisão de Nicolás Maduro e Lula foi citado",Estadão,https://www.estadao.com.br/estadao-verifica/venezuela-comecou-a-dedurar-prisao-nicolas-maduro-hugo-carvajal-enganoso/,Enganoso,2026-01-09 08:00:00,https://encrypted-tbn0.gstatic.com/images?q=tbn:ANd9GcQDl9F8OwQl2bKphO4GZkVbRaJSTdFMCHJ2mJH58RBAb1OZSpyD,"['Nicolás Maduro', 'Venezuela', 'Luiz Inácio Lula da Silva', 'Prisão']"
Assessores do PT ganharam R$ 120 milhões na Mega-Sena da virada de 2026,UOL Notícias,https://noticias.uol.com.br/confere/ultimas-noticias/2026/01/05/assessores-do-pt-ganharam-r-120-milhoes-na-mega-sena-em-2019.htm,Distorcido,2026-01-05 08:00:00,https://encrypted-tbn0.gstatic.com/images?q=tbn:ANd9GcQpP2SjQm_kr9B2BBQ4nKJPNGcAWiH6uj5eWsY7XYi4GkU_adxE,"['Mega-Sena', '2026']"
Fraudes no INSS financiaram campanhas eleitorais do PT,Estadão,https://www.estadao.com.br/estadao-verifica/careca-inss-financiou-campanha-pt-dilma-enganoso/,Enganoso,2025-10-03 07:00:00,https://encrypted-tbn1.gstatic.com/images?q=tbn:ANd9GcTTM2I67wLzZAazd6HZZHEmKmMOiX09TxB0MzfsC_xJNbi4qFd9,"['Instituto Nacional do Seguro Social', 'Partido dos Trabalhadores', 'INSS', 'Partido dos Trabalhadores', 'Esquema de fraudes no INSS', 'Eleição', 'Campanha eleitoral', 'Fraude']"
Vazou áudio William Bonner Globo lucra bilhões com o PT no governo,UOL Notícias,https://noticias.uol.com.br/confere/ultimas-noticias/2025/09/09/e-falso-audio-de-bonner-falando-que-ajudou-a-eleger-lula.htm,Falso,2025-09-09 07:00:00,https://encrypted-tbn0.gstatic.com/images?q=tbn:ANd9GcQ2ryf4HwFbURQmmi5mCQLBG7g3Tyv-UVmqDj_mTXHrX0ajLgI7,"['William Bonner', 'Partido dos Trabalhadores', 'TV Globo', 'Partido dos Trabalhadores', 'Lucro']"
O programa foi criado pelo PT para atender a ditadura cubana.,Aos Fatos,https://www.aosfatos.org/noticias/o-que-e-falso-e-o-que-e-verdadeiro-sobre-o-programa-mais-medicos/,falso,2025-08-14 07:00:00,https://encrypted-tbn1.gstatic.com/images?q=tbn:ANd9GcQN1Af4X7qSBrmOskWjT8w6VskKxvRxgylEHpYlWIveWjfwsNdR,"['Cubanos', 'Partido dos Trabalhadores', 'Partido dos Trabalhadores', 'Ditadura']"
Luciano Hang declarou voto em Lula (PT) para 2026,UOL Notícias,https://noticias.uol.com.br/comprova/ultimas-noticias/2025/08/08/video-tem-audio-manipulado-para-inventar-apoio-de-hang-a-lula-em-2026.htm,Falso,2025-08-08 07:00:00,https://encrypted-tbn2.gstatic.com/images?q=tbn:ANd9GcQ1b8DGNwAF-fPywGKBMHadXVNz78_Lc4v0q04isUg7EW9pDYTH,"['Luciano Hang', 'Luiz Inácio Lula da Silva', 'Partido dos Trabalhadores', '2026', 'Votação', 'Partido dos Trabalhadores']"
Vídeo de Lindbergh Farias tem relação com assalto à casa da ex-esposa de Bolsonaro,Aos Fatos,https://www.aosfatos.org/noticias/video-de-deputado-do-pt-nao-tem-relacao-com-assalto-a-casa-de-ex-mulher-de-bolsonaro/,falso,2025-08-29 07:00:00,https://encrypted-tbn3.gstatic.com/images?q=tbn:ANd9GcS1x9eezmK9303sZTjdyB7r1o5SLM-9SWIii_XRNC4KpxYia0F1,"['Jair Bolsonaro', 'Assalto', 'Lindbergh Farias', 'Casa', 'Vídeo']"
"O deputado federal Lindbergh Farias (PT-RJ) seria o mandante da facada contra Jair Bolsonaro (PL) em 2018, cometida por Adélio Bispo de Oliveira",UOL Notícias,https://noticias.uol.com.br/comprova/ultimas-noticias/2025/08/04/adelio-atacou-bolsonaro-sem-auxilio-externo-concluiram-investigadores.htm,Falso,2025-08-04 07:00:00,https://encrypted-tbn3.gstatic.com/images?q=tbn:ANd9GcSlejIvPJ98v-eRt3NXS5YO0yO08wzkgL2BXKNotZlH4upWWqt8,"['Adélio Bispo', 'Jair Bolsonaro', 'Deputado', 'Lindbergh Farias', 'Partido dos Trabalhadores', 'Deputado Federal do Brasil', 'Partido Liberal', 'Partido dos Trabalhadores']"
PT comprou filiados com R$ 100 na quadra da Unidos da Vila Kennedy,Estadão,https://www.estadao.com.br/estadao-verifica/video-escola-de-samba-eleicoes-internas-compra-de-filiados-enganoso/,Enganoso,2025-07-24 07:00:00,https://encrypted-tbn1.gstatic.com/images?q=tbn:ANd9GcT2KRxIC6Nn7JkLv5PKkY8tXvUCYIs6lWOZNIpOC0ssRYxod5sb,"['Partido dos Trabalhadores', 'Partido dos Trabalhadores', 'Filiação', 'Unidos da Vila Kennedy', 'Vila Kennedy']"
"A governadora do PT Fátima Bezerra inaugurou um cano... Isso mesmo, UM CANO! 'Teje entregue!'",UOL Notícias,https://noticias.uol.com.br/confere/ultimas-noticias/2025/07/11/obra-hidrica-entregue-por-fatima-bezerra.htm,Distorcido,2025-07-11 07:00:00,https://encrypted-tbn3.gstatic.com/images?q=tbn:ANd9GcS4qIJVX6iZlzCsv271Aj6MOTSEaNcguYNrTlnhELBufBOAwY3E,"['Fátima Bezerra', 'Governador', 'Tubo', 'Partido dos Trabalhadores', 'Partido dos Trabalhadores']"
Vídeo mostra manifestação do PT a favor do aumento do IOF,Aos Fatos,https://www.aosfatos.org/noticias/video-mostra-torcida-de-time-marroquino-nao-protesto-do-pt-a-favor-do-aumento-do-iof/,falso,2025-07-09 07:00:00,https://encrypted-tbn2.gstatic.com/images?q=tbn:ANd9GcQhd4A8qtoOcV_fOvwIFqFYHcpIrvdeN9Ex8bnAnMgO_y67cRF2,"['Imposto sobre Operações Financeiras', 'Manifestação', 'Vídeo']"
A apresentadora afirma que o presidente Luiz Inácio Lula da Silva (PT) teria ficado incomodado com comentários do papa Leão 14 sobre ele.,UOL Notícias,https://noticias.uol.com.br/comprova/ultimas-noticias/2025/05/22/video-usa-ia-para-simular-critica-do-papa-a-lula-no-jornal-nacional.htm,Falso,2025-05-22 07:00:00,https://encrypted-tbn2.gstatic.com/images?q=tbn:ANd9GcQtunODl1TV87Dc04BadrRpdIQdp5WwCyFM_v70zGz3Eo704-SW,"['Luiz Inácio Lula da Silva', 'Papa', 'Presidente', 'Partido dos Trabalhadores', 'Apresentador de televisão', 'Partido dos Trabalhadores']"
PT derrubou medida contra fraudes no INSS em 2022,Aos Fatos,https://www.aosfatos.org/noticias/todos-os-partidos-votaram-para-derrubar-medida-contra-fraudes-inss-nao-so-pt/,não_é_bem_assim,2025-05-16 07:00:00,https://encrypted-tbn0.gstatic.com/images?q=tbn:ANd9GcSLfCs2Qxm4yWas6XSjTz9GD2gHdaSh7cVMyyBBUV2didGlajkD,"['Instituto Nacional do Seguro Social', 'INSS', 'Partido dos Trabalhadores', 'Partido dos Trabalhadores', 'Esquema de fraudes no INSS', 'Fraude', '2022']"
Vídeo que o PT nega existir. Nine interagindo com o Marcola,UOL Notícias,https://noticias.uol.com.br/confere/ultimas-noticias/2025/05/08/lula-nao-estava-com-o-marcola-criminoso-do-pcc.htm,Falso,2025-05-08 07:00:00,https://encrypted-tbn3.gstatic.com/images?q=tbn:ANd9GcSi02f8pWiXqqkGnFt_RGdhKibVVMQu_Qvh3vBg1yHm001EHJzg,"['Marcola', 'Partido dos Trabalhadores', 'Vídeo', 'Partido dos Trabalhadores']"
Imagem do evento do PT no dia do trabalhador esvaziado em 2025,AFP Checamos,https://checamos.afp.com/doc.afp.com.44KH7T2,Enganoso,2025-05-05 07:00:00,https://encrypted-tbn0.gstatic.com/images?q=tbn:ANd9GcTtPRZQECc2Lafq322ZjNwlxIn6gLX6uyv09l0vJD1g7RcCE3ZJ,"['Trabalhador', '2025', 'Imagem', 'Dia', 'Partido dos Trabalhadores', 'Partido dos Trabalhadores']"
"Efeito Lula, picanha a R$39,99. Isso é o PT acabando com o Brasil. Faz o L, Lula trabalha pro povo ser feliz.",UOL Notícias,https://noticias.uol.com.br/confere/ultimas-noticias/2025/04/03/post-omite-que-picanha-a-r3999-no-jornal-nacional-era-proxima-a-validade.htm,Distorcido,2025-04-03 07:00:00,https://encrypted-tbn0.gstatic.com/images?q=tbn:ANd9GcTgUcKAj_8019XGTs9FJQxa5yZWvyjHS0RJCIqNOr3BiB3cO9R3,"['Picanha', 'Brasil', 'Efeito Lula', 'Luiz Inácio Lula da Silva', 'Faz o L', 'Partido dos Trabalhadores', 'Partido dos Trabalhadores']"
Pesquisa revela que 82% dos brasileiros deportados dos Estados Unidos votaram em Lula (PT) na última eleição,Aos Fatos,https://www.aosfatos.org/noticias/percentual-falso-deportados-votaram-em-lula/,falso,2025-02-03 08:00:00,https://encrypted-tbn2.gstatic.com/images?q=tbn:ANd9GcTx0dJa50ivvTupeAGgYLavIt398ukcnjCtpPdir2oPch8taYoU,"['Luiz Inácio Lula da Silva', 'Estados Unidos', 'Eleição', 'Brasil', 'Partido dos Trabalhadores', 'Pesquisa', 'Partido dos Trabalhadores']"
Desembargador defendeu bolsonarista que matou tesoureiro do PT durante festa de aniversário,Aos Fatos,https://www.aosfatos.org/noticias/falso-desembargador-petista-assassinado-pessoa-de-ma-qualidade/,falso,2024-12-18 08:00:00,https://encrypted-tbn1.gstatic.com/images?q=tbn:ANd9GcTIRzXnkT9Kc0COIPQMCa59J2PGM4le1pRXucayDr68xNhW8kXt,"['Desembargador', 'Partido dos Trabalhadores', 'Partido dos Trabalhadores', 'Festa', 'Aniversário']"
Lula (PT) vendeu a maior reserva de urânio da Amazônia para a China,Aos Fatos,https://www.aosfatos.org/noticias/lula-nao-vendeu-reserva-de-uranio-para-a-china/,falso,2024-11-29 08:00:00,https://encrypted-tbn3.gstatic.com/images?q=tbn:ANd9GcQfE9zMd5n5l4ckwh6j7qjK6GGv-QycjFrFeZsQLiT53o0m7rzY,"['Luiz Inácio Lula da Silva', 'Urânio', 'China', 'Partido dos Trabalhadores', 'Amazônia', 'Partido dos Trabalhadores']"
"Foi filmada uma reunião secreta do crime organizado com Lula (PT) e Freixo (PT), com a presença de Fernandinho Beira-Mar.",Aos Fatos,https://www.aosfatos.org/noticias/video-reuniao-lula-famosos-nao-fernandinho-beira-mar/,falso,2024-11-28 08:00:00,https://encrypted-tbn0.gstatic.com/images?q=tbn:ANd9GcT7ECxUeLA1qYTGvEDOkWRaEec98aW6gSHXaAOX1J-Yr23_eVC8,"['Fernandinho Beira-Mar', 'Luiz Inácio Lula da Silva', 'Marcelo Freixo', 'Partido dos Trabalhadores', 'Partido dos Trabalhadores', 'Crime']"
Caixa Econômica Federal foi à falência por responsabilidade do presidente Lula (PT),UOL Notícias,https://noticias.uol.com.br/comprova/ultimas-noticias/2024/11/22/saiba-o-que-mudou-no-financiamento-da-caixa-e-o-que-isso-diz-sobre-o-banco.htm,Falso,2024-11-22 08:00:00,https://encrypted-tbn2.gstatic.com/images?q=tbn:ANd9GcRQkwzhkUsfp8BoKVu3qktImogAOO0ofjalLcg3VeJTzsif6w15,"['Caixa Econômica Federal', 'Caixa Econômica Federal', 'Federal', 'Presidente', 'Luiz Inácio Lula da Silva', 'Partido dos Trabalhadores', 'Falência', 'Partido dos Trabalhadores']"
"José Augusto, líder do PT e MST no Rio Grande do Sul, fala em invadir terras e fazendas",Estadão,https://www.estadao.com.br/estadao-verifica/lider-pt-mst-rs-jose-augusto-invasao-terras-falso/,Falso,2024-10-23 07:00:00,https://encrypted-tbn1.gstatic.com/images?q=tbn:ANd9GcTMO93aJdW5ilMjbWlAuNUXwN9MB1pMGfqVX0ZjdGiEugBIH-sY,"['Movimento dos Trabalhadores Rurais sem Terra', 'Partido dos Trabalhadores', 'Liderança', 'Partido dos Trabalhadores', 'Região Sul do Brasil', 'Rio Grande']"
O PT venceu em 46 prefeituras no primeiro turno das eleições de 2024,AFP Checamos,https://checamos.afp.com/doc.afp.com.36K39D8,Falso,2024-10-14 07:00:00,https://encrypted-tbn1.gstatic.com/images?q=tbn:ANd9GcQZfl_UmhaixSF7GgImMZa5RNw7IRrtyNYPFu_cA6mMcLJUbYL1,"['Partido dos Trabalhadores', 'Partido dos Trabalhadores', 'Eleição', 'Eleições municipais no Brasil em 2024', '2024', 'Prefeito no Brasil']"
PT só venceu a disputa para prefeitura em 46 municípios,UOL Notícias,https://noticias.uol.com.br/comprova/ultimas-noticias/2024/10/11/pt-conquistou-248-prefeituras-em-2024-e-nao-46-como-alega-post.htm,Falso,2024-10-11 07:00:00,https://encrypted-tbn2.gstatic.com/images?q=tbn:ANd9GcSc85o6HG6zNg-gq--dPveg1UlQ85z_jagsQUSOYdNy4w2ZiHxz,"['Partido dos Trabalhadores', 'Partido dos Trabalhadores', 'Prefeito no Brasil', 'Municípios do Brasil']"
PT teria conquistado 46 prefeituras no primeiro turno das eleições de 2024,Metrópoles,https://www.metropoles.com/projeto-comprova/pt-conquistou-248-prefeituras-em-2024-e-nao-46-como-alega-post,Falso,2024-10-11 07:00:00,https://encrypted-tbn1.gstatic.com/images?q=tbn:ANd9GcRSv_HI1GHx6L6rr3CBwUS7BHV3pMsw59aZiRUH0rSJV46pn0po,"['Partido dos Trabalhadores', 'Prefeito no Brasil', '2024', 'Eleição', 'Eleições municipais no Brasil em 2024', 'Partido dos Trabalhadores']"
Mapas mostram onde esquerda venceu em eleições municipais desde 2004,Estadão,https://www.estadao.com.br/estadao-verifica/mapas-esquerda-eleicoes-municipais/,Enganoso,2024-11-04 08:00:00,https://encrypted-tbn0.gstatic.com/images?q=tbn:ANd9GcTYh7epsLgf_j3KB9DwHPx0VVcXqVqT3_JfvK0zD8dBWAb49D1X,"['Eleição', 'Esquerda', 'Mapa', '2004', 'Eleições municipais no Brasil']"
"O mesmo país que supostamente elegeu Lula escolheu prefeitos do PT em apenas 46 cidades, enquanto o PL de Bolsonaro elegeu 508 prefeitos",Estadão,https://www.estadao.com.br/estadao-verifica/pt-46-pl-508-prefeitos-eleitos-falso/,Falso,2024-10-08 07:00:00,https://encrypted-tbn3.gstatic.com/images?q=tbn:ANd9GcSqTcqY2EIt-FzyPF9zMnuvNP-S5luG46SZGD-Ot8y31MEV0ebf,"['Partido dos Trabalhadores', 'Partido dos Trabalhadores', 'Prefeito', 'Partido Liberal', 'Luiz Inácio Lula da Silva', 'Jair Bolsonaro', 'Cidade']"
PT elegeu apenas 46 prefeitos na eleição municipal de 2024,Aos Fatos,https://www.aosfatos.org/noticias/pt-elegeu-248-prefeitos-nao-46/,falso,2024-10-07 07:00:00,https://encrypted-tbn1.gstatic.com/images?q=tbn:ANd9GcQcalsqhjxXoFbqicTl_a-S_TL1L74T2Zb4BUbcMbf-AVwJVoZS,"['Partido dos Trabalhadores', 'Eleição', 'Partido dos Trabalhadores', 'Prefeito', 'Eleições municipais no Brasil em 2024', 'Eleição municipal', '2024']"
Candidato que atirou dinheiro à população em Coari (AM) é do PT,Estadão,https://www.estadao.com.br/estadao-verifica/candidato-prefeito-chuva-dinheiro-pt-enganoso/,Falso,2024-10-06 07:00:00,https://encrypted-tbn3.gstatic.com/images?q=tbn:ANd9GcTDRL9v8bcDp3R5hZC9onKgwDJgcpA_0-mK3PuIbjCf4128NXAI,"['Partido dos Trabalhadores', 'Candidato', 'Partido dos Trabalhadores', 'Amazonas', 'Dinheiro', 'Coari', 'Coari']"
"""Na época do PT, lá eram 150 mil crianças querendo uma vaga de creche e não tinha aqui na cidade mais rica.""",Aos Fatos,https://www.aosfatos.org/noticias/checamos-ricardo-nunes-inteligencia-ltda/,verdadeiro,2024-09-21 07:00:00,https://encrypted-tbn0.gstatic.com/images?q=tbn:ANd9GcT0CHEq2g6rpBMDBMHEfBWXXaq_cQdzXqieVFqqDABS6-d7cIMz,"['Partido dos Trabalhadores', 'Cidade', 'Criança', 'Partido dos Trabalhadores', 'Creche']"
Candidato a prefeito que fez chuva de dinheiro para eleitores no Amazonas e foi preso em flagrante pela PF é do PT,UOL Notícias,https://noticias.uol.com.br/confere/ultimas-noticias/2024/10/05/candidato-preso-por-distribuir-dinheiro-no-am-nao-e-do-pt.htm,Distorcido,2024-10-05 07:00:00,https://encrypted-tbn3.gstatic.com/images?q=tbn:ANd9GcTPXRDnX4wf_NMVLQ8SL-k4d4UXyEOJ_CB2Odlr855SfDU9Om4u,"['Candidato', 'Dinheiro', 'Eleição', 'Amazonas', 'Prisão', 'Polícia Federal', 'Departamento de Polícia Federal', 'Chuva', 'Prefeito']"
Vídeo mostra ato conjunto de CV e PT em apoio a Eduardo Paes,Projeto Comprova,https://projetocomprova.com.br/publica%C3%A7%C3%B5es/video-falso-e-usado-para-atribuir-apoio-do-comando-vermelho-a-eduardo-paes/,Falso: As imagens são de um comício de Lula no Complexo do Alemão em 2022. Não há registro de qualquer relação com o crime organizado.,2024-08-16 07:00:00,,"['Comando Vermelho', 'Eduardo Paes', 'Vídeo', 'Partido dos Trabalhadores', 'Partido dos Trabalhadores']"
Comando Vermelho e PT apoiam abertamente reeleição de Eduardo Paes,AFP Checamos,https://checamos.afp.com/doc.afp.com.36E74BH,Falso,2024-08-14 07:00:00,https://encrypted-tbn3.gstatic.com/images?q=tbn:ANd9GcTJ4jwxaCqGRK4vYalKvQ9vUZ9DesjLn29R4-P4V7N40zXN0Hn-,"['Eduardo Paes', 'Partido dos Trabalhadores', 'Partido dos Trabalhadores', 'Comando Vermelho', 'Reeleição']"
"NANOEMPREENDEDOR. Revendedoras serão taxadas, por projeto do PT. Lula vai taxar as pessoas que revendem: Natura, AVON, Boticário, Eudora, Jequiti, Mary Kay e muitas outras marcas. Será criado o 'nanoempreendedor' que vai abocanhar parte da sua comissão",UOL Notícias,https://noticias.uol.com.br/confere/ultimas-noticias/2024/07/22/pt-nao-tem-projeto-para-taxar-revendedores-de-cosmeticos.htm,Falso,2024-07-22 07:00:00,https://encrypted-tbn2.gstatic.com/images?q=tbn:ANd9GcRK3moQZYDZYRSHmM8k-gStGChW7ntjfoFYToauyqxbhQB1pzGf,"['Taxa', 'Partido dos Trabalhadores', 'Luiz Inácio Lula da Silva', 'Partido dos Trabalhadores', 'O Boticário', 'Jequiti', 'O Boticário', 'O Boticário']"
Nanoempreendedor e revendedoras de cosméticos serão taxadas por projeto do PT,AFP Checamos,https://checamos.afp.com/doc.afp.com.364P4NB,Falso,2024-07-22 07:00:00,https://encrypted-tbn2.gstatic.com/images?q=tbn:ANd9GcSnmz8xXNT6TMobtRDY7j__e8uHdAuWzQ9gUgYSbqncTG6BO9gi,"['Cosmético', 'Partido dos Trabalhadores', 'Projeto', 'Partido dos Trabalhadores']"
Quebramos! Deputado do PT diz que o governo está sem dinheiro para manter o básico!,UOL Notícias,https://noticias.uol.com.br/confere/ultimas-noticias/2024/07/16/deputado-do-pt-nao-diz-em-entrevista-que-pais-esta-quebrado.htm,Distorcido,2024-07-16 07:00:00,https://encrypted-tbn2.gstatic.com/images?q=tbn:ANd9GcQq6JldG13Ohlp-tOJp6ws3xchjMkUrsKSeLEMwdq_iiDNBM5uw,"['Partido dos Trabalhadores', 'Deputado', 'Partido dos Trabalhadores', 'Governo', 'Dinheiro']"
"""Estravio de bens da União na era PT"". A PF indiciou Lula e Dilma? Alguém sabe me dizer?",UOL Notícias,https://noticias.uol.com.br/confere/ultimas-noticias/2024/07/11/tcu-lula-e-dilma-itens-presidencia.htm,Distorcido,2024-07-11 07:00:00,https://encrypted-tbn0.gstatic.com/images?q=tbn:ANd9GcSSB7xG4tB5NwhZvWbUhHQ0gs6hq7wdHNTYEOlM1MROm316XtDG,"['Luiz Inácio Lula da Silva', 'Dilma Rousseff', 'Partido dos Trabalhadores', 'União Brasil', 'Partido dos Trabalhadores', 'Departamento de Polícia Federal', 'Polícia Federal', 'Indiciamento']"
Deputado do PT diz que governo está sem dinheiro para manter o básico,Estadão,https://www.estadao.com.br/estadao-verifica/lindbergh-farias-quebramos-sem-dinheiro-manter-basico/,Enganoso,2024-07-11 07:00:00,https://encrypted-tbn0.gstatic.com/images?q=tbn:ANd9GcRenoo0gDWyKSq-Ba4DhU31o7Uxp0U_ueV6Ep7gF5eXBKT8DLKY,"['Partido dos Trabalhadores', 'Deputado', 'Governo', 'Partido dos Trabalhadores', 'Dinheiro']"
Deputado do PT afirma que governo não tem dinheiro para manter o básico,Aos Fatos,https://www.aosfatos.org/noticias/lindbergh-nao-disse-governo-esta-sem-dinheiro/,falso,2024-07-11 07:00:00,https://encrypted-tbn1.gstatic.com/images?q=tbn:ANd9GcSHVG4ohdTy0TU_1iOKD2V-FB2V1S2QC6GRqRHxWsNoewUjhjro,"['Partido dos Trabalhadores', 'Deputado', 'Partido dos Trabalhadores', 'Governo', 'Dinheiro']"
Ainda ontem dia 27/06 a PM prendeu um carro do ministro da economia de Lula do PT com 30k de cocaína.,UOL Notícias,https://noticias.uol.com.br/confere/ultimas-noticias/2024/07/03/carro-da-receita-apreendido-com-cocaina-nao-e-de-fernando-haddad.htm,Falso,2024-07-03 07:00:00,https://encrypted-tbn1.gstatic.com/images?q=tbn:ANd9GcRQXzeVbwBJC9Js9H8iWC8rbM61ukAGjJ_tCgb8WCaplkSSGvVZ,"['Cocaína', 'Automóvel', 'Partido dos Trabalhadores', 'Ministro', 'Luiz Inácio Lula da Silva', 'Polícia militar', 'Economia', 'Partido dos Trabalhadores']"
"Vídeos com recortes de discursos de Lula em Teresina, no dia 21 de junho de 2024, e em convenção do PT, em 8 de dezembro de 2023, em que o presidente teria dito que políticos não deveriam cuidar de pessoas pobres porque quando elas estudam e ascendem socialmente deixam de votar.",Folha - UOL,https://www1.folha.uol.com.br/poder/2024/07/publicacao-distorce-fala-de-lula-sobre-populacao-carente.shtml,Enganoso,2024-07-02 07:00:00,https://encrypted-tbn1.gstatic.com/images?q=tbn:ANd9GcTudyxQ-sujt1dW9-IQ-uRw6SWeqtEVInfLVe_WJkxVEdoYkxhS,"['Luiz Inácio Lula da Silva', 'Partido dos Trabalhadores', 'Partido dos Trabalhadores', 'Presidente', 'Discurso', 'Votação', 'Junho', 'Dezembro', '2023']"
"Existe um túmulo onde estaria sepultado o presidente Luiz Inácio Lula da Silva (PT), enquanto outra pessoa governa o país no lugar dele",UOL Notícias,https://noticias.uol.com.br/comprova/ultimas-noticias/2024/06/27/e-satirico-o-video-em-que-homem-diz-estar-indo-investigar-tumulo-de-lula.htm,Sátira,2024-06-27 07:00:00,https://encrypted-tbn0.gstatic.com/images?q=tbn:ANd9GcTEvhUg_Ha5B_8tdsRukxfbGEkoer69YFZnfCHGN6ZXTmSmHUsk,"['Luiz Inácio Lula da Silva', 'Túmulo', 'Presidente', 'Partido dos Trabalhadores', 'Partido dos Trabalhadores', 'Sepultamento']"
"Governo do PT prometeu R$ 195 milhões para a reconstrução de 1500 casas no RS, mas não enviou nada.",Estadão,https://www.estadao.com.br/estadao-verifica/governo-federal-195-milhoes-casas-rio-grande-do-sul/,Enganoso,2024-06-16 07:00:00,https://encrypted-tbn0.gstatic.com/images?q=tbn:ANd9GcSP6sKkMi5RRhUGtzBh_OKixBWICwswlU99XbPlGg09aJzADvf3,"['Rio Grande do Sul', 'Casa', 'Governo', 'Partido dos Trabalhadores', 'Partido dos Trabalhadores']"
Mulher é agredida por não ter votado na vereadora do PT Edilene Pezão,AFP Checamos,https://checamos.afp.com/doc.afp.com.34WQ2GU,Falso,2024-06-14 07:00:00,https://encrypted-tbn1.gstatic.com/images?q=tbn:ANd9GcQRYEx3uEO6ZtQy27V69MTzrt-PTRA7jDOMg8BXPXKvC72-Ayl5,"['Vereador', 'Partido dos Trabalhadores', 'Votação', 'Partido dos Trabalhadores', 'Mulher']"
Advogada detalha golpe que o PT vem realizando contra os aposentados do INSS,Aos Fatos,https://www.aosfatos.org/noticias/para-culpar-pt-video-desconto-indevido-aposentadoria-inss/,falso,2024-06-05 07:00:00,https://encrypted-tbn0.gstatic.com/images?q=tbn:ANd9GcQp-QHw-v0r8o1ClhVcTTlA4Wy8D1_fwdrqYFS75vd9SlO8-ZEL,"['Instituto Nacional do Seguro Social', 'INSS', 'Aposentadoria', 'Partido dos Trabalhadores', 'Partido dos Trabalhadores', 'Golpe', 'Advogado']"
Polícia Federal apreendeu 60 baús no Porto de Santos com bilhões do Brasil que iam para Cuba e voltavam para financiar a guerrilha armada do PT,Estadão,https://www.estadao.com.br/estadao-verifica/bau-medicamentos-pf-porto-de-santos-cuba-guerrilha-pt/,Falso,2024-04-24 07:00:00,https://encrypted-tbn3.gstatic.com/images?q=tbn:ANd9GcQQR1CtP8EJL8K_5QVos7kDg2jFfsyLkjsIh--uopEX9y-0oKse,"['Departamento de Polícia Federal', 'Polícia Federal', 'Partido dos Trabalhadores', 'Brasil', 'Partido dos Trabalhadores', 'Financiamento']"
Meme de eleitor do PT burro é exibido em Nova York em prédios do Elon Musk,Aos Fatos,https://www.aosfatos.org/noticias/meme-eleitor-do-pt-burro-nao-foi-exibido-nova-york/,falso,2024-04-17 07:00:00,https://encrypted-tbn2.gstatic.com/images?q=tbn:ANd9GcSWF9Bgp9SJ0wsrIMCZ3cGjvl9FYhoUp018lyClfkDm8kc7t9aa,"['Partido dos Trabalhadores', 'Partido dos Trabalhadores', 'Eleitor', 'Meme', 'Asno', 'Nova Iorque', 'Elon Musk', 'Edifício']"
Mulher reclama de preços de alimentos e mostra realidade para Lula,Estadão,https://www.estadao.com.br/estadao-verifica/mulher-reclama-precos-alimentos-lula-2022/,Enganoso,2024-04-29 07:00:00,https://encrypted-tbn0.gstatic.com/images?q=tbn:ANd9GcSxMgTXoEE5pAra4L2cfstAh7v9S-JYKlSASv-EqRWj85H0wNY-,"['Luiz Inácio Lula da Silva', 'Alimento', 'Mulher', 'Preço', 'Realidade']"
"Vídeo mostra um site que provaria que os documentos do pai do autor do post, morto há mais de duas décadas, foram usados para votar no presidente Luiz Inácio Lula da Silva (PT) nas eleições de 2022.",Folha - UOL,https://www1.folha.uol.com.br/poder/2024/04/e-falso-que-dados-de-homem-morto-tenham-sido-usados-para-registrar-voto-em-2022.shtml,Falso,2024-04-02 07:00:00,https://encrypted-tbn3.gstatic.com/images?q=tbn:ANd9GcSLMu8O_dA9k3hmKINcs0tYRl4MU3SkVf-VWNPBEpZFnXXvJedW,"['Votação', 'Eleição', 'Luiz Inácio Lula da Silva', 'Partido dos Trabalhadores', '2022', 'Morte', 'Presidente', 'Partido dos Trabalhadores', 'Eleições presidenciais brasileiras, 2022']"
