Claim,Source Name,Source URL,Verdict,Review Publication Date,Image URL,Tags
Voto impresso aprovado na CCJ recentemente.,Aos Fatos,https://www.aosfatos.org/noticias/voto-impresso-foi-aprovado-na-ccj-em-2019-nao-recentemente/,distorcido,2021-04-08 07:00:00,https://encrypted-tbn2.gstatic.com/images?q=tbn:ANd9GcQsWKprjR4VigFVT9CsEDQjSZBINQqehfDw53-Iu42opF4dhhLr,"['Comprovante de votação verificado pelo eleitor', 'Votação', 'Comissão de Constituição, Justiça e Cidadania do Senado Federal do Brasil']"
Nos falta a possibilidade de auditar se o voto computado e totalizado eletronicamente corresponde materialmente ao voto impresso,Aos Fatos,https://www.aosfatos.org/noticias/relatorio-novo-codigo-eleitoral-usa-desinformacao-justificar-voto-impresso/,falso,2025-08-25 07:00:00,https://encrypted-tbn2.gstatic.com/images?q=tbn:ANd9GcTjp31mOKOEh0NBcm_m8RBROcofAPv6gq1zQK98pElN3LExhMUf,"['Comprovante de votação verificado pelo eleitor', 'Votação', 'Auditoria']"
Parágrafo da lei 10.408/2002 garante voto impresso,Aos Fatos,https://www.aosfatos.org/noticias/trecho-de-lei-de-2002-que-determinava-impressao-do-voto-nao-esta-mais-em-vigor/,falso,2021-07-12 07:00:00,https://encrypted-tbn0.gstatic.com/images?q=tbn:ANd9GcS9ftFzZ8ApiK0imb2WAuht2v4GVJJDj-xzC0n4owCX0YF6KfRv,"['Votação', 'Comprovante de votação verificado pelo eleitor', 'Lei']"
TSE não cumpre lei para impressão do voto sancionada por Lula,Aos Fatos,https://www.aosfatos.org/noticias/stf-derrubou-lei-lula-voto-impresso/,falso,2022-07-05 07:00:00,https://encrypted-tbn0.gstatic.com/images?q=tbn:ANd9GcR7au648dIIqiy3VGlYEHk1WJ4SmTaaOg1jvk7SexbAdFMSfVI-,"['Luiz Inácio Lula da Silva', 'Votação', 'Tribunal Superior Eleitoral', 'Lei', 'Sanção jurídica']"
Supremo Tribunal Federal (STF) considerou o voto impresso inconstitucional,Projeto Comprova,https://projetocomprova.com.br/publica%C3%A7%C3%B5es/tuite-engana-ao-dizer-que-o-stf-decidiu-que-voto-impresso-e-inconstitucional/,"Enganoso: Na realidade, o STF não decidiu que o voto impresso era inconstitucional, mas sim um artigo da reforma eleitoral segundo o qual deveria ser feita a impressão de um comprovante após o voto nas urnas eletrônicas",2020-09-17 07:00:00,https://encrypted-tbn3.gstatic.com/images?q=tbn:ANd9GcSZ8OaFrSQqtN_6iiJVnWgNwE8LYh43W13di0g6eut50fT7zCwc,"['Comprovante de votação verificado pelo eleitor', 'Votação', 'Supremo Tribunal Federal', 'Tribunal']"
Voto impresso já é lei e deveria estar sendo implantado. Lei 10408,Projeto Comprova,https://projetocomprova.com.br/publica%C3%A7%C3%B5es/posts-enganam-ao-afirmar-que-voto-impresso-ja-e-lei/,"ENGANOSO: O conteúdo verificado destaca trecho revogado da Lei 10.408, que dispõe sobre um mecanismo da urna que permite a impressão do voto.",2021-07-19 07:00:00,,"['Votação', 'Comprovante de votação verificado pelo eleitor', 'Lei']"
Lula perdeu todas as eleições feitas com cédulas de papel e venceu todas após as urnas eletrônicas,Aos Fatos,https://www.aosfatos.org/noticias/falso-que-lula-so-venceu-eleicoes-apos-urnas-eletronicas/,falso,2025-12-09 08:00:00,https://encrypted-tbn1.gstatic.com/images?q=tbn:ANd9GcRe5e01nS8_OJfem_RbqwCjJv7y3lPetCtiTa6iWoWPz3OyEiZ8,"['Luiz Inácio Lula da Silva', 'Eleição', 'Urna eleitoral', 'Papel', 'Cédula eleitoral', 'Urna eletrônica']"
Barroso pagou 9 milhões para cada líder e vice-líder partidário para que trocassem os deputados que votariam a favor do voto impresso por políticos que eram contrários.,UOL Notícias,https://noticias.uol.com.br/confere/ultimas-noticias/2025/08/13/e-falso-que-barroso-pagou-para-deputados-votarem-contra-voto-impresso.htm,Falso,2025-08-13 07:00:00,https://encrypted-tbn1.gstatic.com/images?q=tbn:ANd9GcSi0rEHu1PM_OFpTboM0KZsRGLtK0NX8hdofj81tJpeoHacqHft,"['Luís Roberto Barroso', 'Comprovante de votação verificado pelo eleitor', 'Votação', 'Deputado', 'Político', 'Liderança', 'Líder de partido']"
Só o Brasil usa urnas eletrônicas,Estadão,https://www.estadao.com.br/estadao-verifica/apenas-brasil-urna-eletronica-falso/,Falso,2024-10-08 07:00:00,https://encrypted-tbn2.gstatic.com/images?q=tbn:ANd9GcQBq5bRLsBSbQbN7XekxSQCvE7lPwuSsrhyYOdDXcj3cD3dcwuv,"['Urna eletrônica', 'Urna eleitoral', 'Brasil']"
"Países que fizeram a eleição com cédula de papel ou urnas com voto impresso, como Paraguai, Uruguai, Equador e Argentina, tiveram derrota da esquerda",Estadão,https://www.estadao.com.br/estadao-verifica/voto-impresso-direita-esquerda-falso/,Falso,2024-06-21 07:00:00,https://encrypted-tbn0.gstatic.com/images?q=tbn:ANd9GcRxLQo3SVz8isn-NkR8FYANGo53aMOT3HbyfD-GypjFyqOa8f0r,"['Comprovante de votação verificado pelo eleitor', 'Votação', 'Eleição', 'Esquerda', 'Urna eleitoral', 'Argentina', 'País', 'Papel', 'Paraguai']"
Rodrigo Pacheco acatou projeto do voto impresso e abriu votação no site do Senado,Aos Fatos,https://www.aosfatos.org/noticias/e-falso-que-rodrigo-pacheco-acatou-projeto-que-institui-voto-auditavel-no-brasil/,falso,2021-07-06 07:00:00,https://encrypted-tbn3.gstatic.com/images?q=tbn:ANd9GcSxQCLMYtGUgxjbQJ4yLcbvxXyijiZESrJyGR1RSZ9-d5cpA3_j,"['Rodrigo Pacheco', 'Votação', 'Senado Federal do Brasil', 'Comprovante de votação verificado pelo eleitor', 'Projeto']"
Nunca se falou de contagem manual em discussão sobre voto impresso,UOL Notícias,https://noticias.uol.com.br/confere/ultimas-noticias/2022/06/27/contagem-manual-de-voto-impresso-foi-discutida-e-barrada-na-camara.htm,Verdadeiro,2022-06-27 07:00:00,https://encrypted-tbn2.gstatic.com/images?q=tbn:ANd9GcTeJ1i5XVUKzcMrIOt6PnmT_RdCvJrqU46WZmilwbFu3Wx6U4zz,"['Comprovante de votação verificado pelo eleitor', 'Votação', 'discussão']"
Barroso sempre foi a favor do voto impresso,UOL Notícias,https://noticias.uol.com.br/confere/ultimas-noticias/2022/06/28/e-falso-que-ministro-barroso-defendeu-voto-impresso-em-2017.htm,Falso,2022-06-28 07:00:00,https://encrypted-tbn0.gstatic.com/images?q=tbn:ANd9GcSfJurUtDLSEfuaznlwH5VFxZ8rn6Aq_UBZZP8-E2P4mzLx-2NM,"['Luís Roberto Barroso', 'Comprovante de votação verificado pelo eleitor', 'Votação']"
"ITA e IME, institutos militares, fizeram protótipo de urnas para voto impresso, mas foram vetados pelo TSE (Tribunal Superior Eleitoral)",UOL Notícias,https://noticias.uol.com.br/confere/ultimas-noticias/2020/10/22/ita-ime-urnas-voto-impresso-tse.htm,Falso,2020-10-22 07:00:00,https://encrypted-tbn3.gstatic.com/images?q=tbn:ANd9GcRxNlQJpC50ByOxLNYW9mbLZOIr8qBHz4-G6Wk7pH3NWDY6wz-N,"['Comprovante de votação verificado pelo eleitor', 'Urna eleitoral', 'Tribunal Superior Eleitoral', 'Votação', 'Eleição', 'Veto', 'Instituto Militar de Engenharia', 'Instituto Tecnológico de Aeronáutica', 'Tribunal', 'Protótipo']"
Eleições com urna eletrônica não são limpas,UOL Notícias,https://noticias.uol.com.br/confere/ultimas-noticias/2021/07/08/eleicoes-brasil-fraude.htm,Falso,2021-07-08 07:00:00,https://encrypted-tbn1.gstatic.com/images?q=tbn:ANd9GcTFsSJtmz6PKZgl-QzjoQ330n59c0cz_7Lotx_JmyYKMW33klmz,"['Eleição', 'Urna eleitoral', 'Máquina de votação', 'Eletrônica']"
91% da população brasileira quer o voto impresso,UOL Notícias,https://noticias.uol.com.br/comprova/ultimas-noticias/2021/07/13/e-enganoso-que-enquete-sobre-voto-impresso-reflita-opiniao-da-populacao.htm,Falso,2021-07-13 07:00:00,https://encrypted-tbn3.gstatic.com/images?q=tbn:ANd9GcTjpTk-VgYup2efhv85E4j4-nc0srxr4TD9oteMZHcAQd0E62DL,"['Comprovante de votação verificado pelo eleitor', 'Votação', 'Demografia do Brasil', 'Brasil']"
"Live sobre voto impresso com Bia Kicis, Alexandre Garcia e outros",UOL Notícias,https://noticias.uol.com.br/confere/ultimas-noticias/2021/04/07/live-de-kicis-repete-argumentos-superados-sobre-seguranca-do-voto-impresso.htm,Falso,2021-04-07 07:00:00,https://encrypted-tbn2.gstatic.com/images?q=tbn:ANd9GcR54ZI4B8Ad-Mej1-VXwkwBj6-9RRSzOTb-DBCxDYlxJB8qZXtb,"['Comprovante de votação verificado pelo eleitor', 'Bia Kicis', 'Votação', 'Alexandre Garcia']"
O Tribunal Superior Eleitoral (TSE) publicou um vídeo em 2017 defendendo o voto impresso,AFP Checamos,https://checamos.afp.com/doc.afp.com.9EE7U2,Sem contexto,2021-07-08 07:00:00,https://encrypted-tbn0.gstatic.com/images?q=tbn:ANd9GcS4PO8zP14mvs_Xemq9aCedkt52SBi0rC3FjE9LXG4yacybhz6d,"['Tribunal Superior Eleitoral', 'Comprovante de votação verificado pelo eleitor', 'Votação', 'Eleição', 'Vídeo', '2017', 'Tribunal']"
"Só Brasil, Butão e Bangladesh usam urnas eletrônicas sem voto impresso",AFP Checamos,https://checamos.afp.com/doc.afp.com.9LM8WF,Sem Contexto,2021-08-25 07:00:00,https://encrypted-tbn1.gstatic.com/images?q=tbn:ANd9GcRPYPaC4yq2QQ1jqxNzSJtwG3FKfzvaGDSPSMPM50dLVVF0l_5T,"['Urna eleitoral', 'Urna eletrônica', 'Votação', 'Comprovante de votação verificado pelo eleitor', 'Brasil', 'Bangladesh', 'Butão']"
Ministro Luís Roberto Barroso já defendeu voto impresso,Aos Fatos,https://www.aosfatos.org/noticias/youtuber-distorce-falas-de-barroso-ao-alegar-mudanca-de-opiniao-sobre-voto-impresso/,distorcido,2021-07-13 07:00:00,,"['Luís Roberto Barroso', 'Comprovante de votação verificado pelo eleitor', 'Votação', 'Ministro']"
Urna eletrônica não permite recontagem de votos,UOL Notícias,https://noticias.uol.com.br/confere/ultimas-noticias/2020/10/07/urna-eletronica-permite-recontagem-de-votos-no-brasil.htm,Falso,2020-10-07 07:00:00,https://encrypted-tbn1.gstatic.com/images?q=tbn:ANd9GcQqKRI1K71Ykuh4dNNd8ozjeQ2_SR7F8VXi1wvvt-li2NxVBche,"['Máquina de votação', 'Urna eleitoral', 'Votação', 'Eletrônica']"
TSE não cumpre lei para impressão de voto sancionada por Lula,AFP Checamos,https://checamos.afp.com/doc.afp.com.32EC8WZ,Sem contexto,2022-07-13 07:00:00,https://encrypted-tbn0.gstatic.com/images?q=tbn:ANd9GcSbzfjhMnTICZYbLsZWyO2-moDJWhzNM8ebzS0a8yncYxKbaJbq,"['Luiz Inácio Lula da Silva', 'Votação', 'Sanção jurídica', 'Lei', 'Tribunal Superior Eleitoral', 'Impressão']"
Ministro Kassio Nunes Marques mudou opinião dos ministros do TSE sobre o voto impresso,Estadão,https://www.estadao.com.br/estadao-verifica/nunes-marques-mudou-opiniao-do-tse-sobre-voto-impresso-enganoso/,Enganoso,2024-12-12 08:00:00,https://encrypted-tbn3.gstatic.com/images?q=tbn:ANd9GcQtStg8pl3BfoprIMHzZWYEbqM-H8TloOA1slKL7GNHjnLA9kWa,"['Nunes Marques', 'Tribunal Superior Eleitoral', 'Comprovante de votação verificado pelo eleitor', 'Votação', 'Ministro', 'Ministro do Tribunal Superior Eleitoral do Brasil', 'Opinião']"
Comparação entre foto do Diretas Já e imagem do ato pelo voto impresso,Aos Fatos,https://www.aosfatos.org/noticias/imagem-de-protesto-contra-dilma-em-2015-e-atribuida-em-posts-ato-por-voto-impresso/,falso,2021-08-03 07:00:00,https://encrypted-tbn2.gstatic.com/images?q=tbn:ANd9GcTz-f5Jt12037CGHHlLbfVJ1GTAYf3sTa9ieyH6F7ChcF6bdzIU,"['Comprovante de votação verificado pelo eleitor', 'Votação', 'Diretas Já', 'Imagem', 'Fotografia']"
Aprovado o voto impresso no brasil,Estadão,https://www.estadao.com.br/estadao-verifica/eduardo-girao-comemora-voto-impresso/,Falso,2024-08-06 07:00:00,https://encrypted-tbn0.gstatic.com/images?q=tbn:ANd9GcTabUrBeVfBI2jLK33-qOTHzfxM-hJQje4QsxmRzhNR24Ehlcu5,"['Votação', 'Brasil', 'Comprovante de votação verificado pelo eleitor']"
Ministro Barroso mentindo no Reino Unido dizendo que o que estava sendo proposto ano passado era o voto em papel com contagem manual,UOL Notícias,https://noticias.uol.com.br/confere/ultimas-noticias/2022/07/07/bolsonaro-nega-mas-contagem-manual-de-voto-impresso-foi-proposta.htm,Falso,2022-07-07 07:00:00,https://encrypted-tbn1.gstatic.com/images?q=tbn:ANd9GcR37ogtoYnl3WUhER1gBgzbxxOUtNG-DxEcUz5IQDEiuLXP3FYu,"['Votação', 'Papel', 'Ministro', 'Luís Roberto Barroso', 'Mentira', 'Reino Unido']"
Bolsonaro volta a defender voto impresso na eleição contra fraudes nas urnas eletrônicas,Projeto Comprova,https://projetocomprova.com.br/publica%C3%A7%C3%B5es/sistema-de-voto-eletronico-pode-ser-auditado-ao-contrario-do-que-afirma-post/,"FALSO: Há diversos mecanismos de auditoria e de verificação dos resultados que podem ser efetuados. Além disso, Ministério Público e Polícia Federal também têm a prerrogativa de investigar o processo eleitoral brasileiro e já realizaram auditorias independentes. Em 24 anos nenhum caso de fraude foi identificado e comprovado",2020-11-13 08:00:00,,"['Urna eletrônica', 'Eleição', 'Votação', 'Urna eleitoral', 'Comprovante de votação verificado pelo eleitor', 'Jair Bolsonaro', 'Fraude']"
Barroso mentiu ao dizer que parlamentares defenderam contagem manual dos votos nas eleições,Aos Fatos,https://www.aosfatos.org/noticias/barroso-contagem-manual-votos/,falso,2023-07-21 07:00:00,https://encrypted-tbn3.gstatic.com/images?q=tbn:ANd9GcQBZLuaNfwi6rn2uU3oUYxAFM-Ve6wGxWaFqxBhlqnIhhcgMcmJ,"['Luís Roberto Barroso', 'Votação', 'Eleição', 'Parlamento']"
